0	1
what is the cheapest round trip flight from atlanta to pittsburgh	flight
what is american 's last flight from boston to washington dc on july twenty first	flight
which airline can fly me from atlanta to denver to san francisco	airline
i need a flight from atlanta to philadelphia and i 'm looking for the cheapest fare	flight
which airlines fly from boston to washington dc but stopover in some other city	airline
what are the fares for flights between atlanta and dfw	airfare
show me the flights from san francisco to boston	flight
show me flights from oakland to dallas on sunday	flight
does continental fly from boston to san francisco	flight
show me the flights from denver to las vegas	flight
i need a thursday flight from pittsburgh to baltimore arriving in baltimore before 9 o'clock	flight
i wish to fly from boston to washington please find an airline for me	flight
display all flights leaving from toronto to san diego on us air laying over in washington dc	flight
i want to go between boston and san francisco	flight
how much is the 718 am flight from las vegas to new york twa	airfare
show me all the eastern airlines flights leaving pittsburgh between 12 and 4 in the afternoon	flight
i need information from denver to pittsburgh	flight
i would like to book a flight that goes from memphis to las vegas	flight
what flights leave from chicago to seattle on saturday	flight
please show me all one way first class flights from indianapolis to memphis	flight
what flights do you have available from denver dallas and pittsburgh into baltimore	flight
show me flights from philadelphia to oakland on friday	flight
flight from dallas to oakland california on monday	flight
list the flights from denver to baltimore	flight
tell me about flights from atlanta to charlotte next monday	flight
show me ground transportation in philadelphia on monday morning	ground_service
what are the flights from denver to baltimore on united airlines	flight
list all the takeoffs and landings at general mitchell airport	flight
i 'd like a flight from san diego to toronto on alaska airlines leaving around 1 pm	flight
cheapest round trip airfare from tacoma to orlando	airfare
name the earliest flight from boston to san francisco	flight
show ground transportation in denver	ground_service
show me fares leaving on tuesdays from denver to go to dallas	airfare
what airlines fly from philadelphia to san francisco	airline
find me a flight on united from boston to san francisco with a stopover in denver	flight
what flights are available from boston to denver	flight
can you list all flights from toronto to san diego	flight
what is the last flight from dallas to boston in the evening	flight
i need to go from boston to atlanta in the same day find me the earliest flight from boston	flight
on november twenty third what flights are available between boston and denver on american airlines	flight
what airlines are ac and as	airline
flights from montreal to las vegas	flight
show me flights to dallas from san francisco and atlanta and pittsburgh	flight
what are the flights from milwaukee to orlando on thursday	flight
i am interested in a flight on american airlines from dallas to washington	flight
list ground transportation options at phoenix	ground_service
show me ground transportation in baltimore	ground_service
which nonstop flight from atlanta to oakland leaves in the afternoon and arrives at 5 pm	flight
hello i 'd like a delta flight from atlanta to boston	flight
what airlines fly boston to baltimore	airline
i 'd like to make a trip from washington to san francisco	flight
list the earliest flights from atlanta to denver on a monday	flight
what is the earliest flight you have that leaves philadelphia to dallas	flight
give me the cheapest one way flights between boston and philadelphia which arrive after noon on a tuesday	flight
can you list all flights between milwaukee and chicago	flight
list united flights from denver to san francisco on tuesdays or wednesdays	flight
how much does flight ua 297 from denver to san francisco cost	airfare
american flights from chicago to los angeles morning	flight
please list the cost of all flights from philadelphia to denver airport next sunday	airfare
show me all midwest express flights from detroit to chicago	flight
what flights are there arriving in chicago after 9 pm on continental	flight
what does ea mean	abbreviation
show me the ground transportation schedule in san francisco on thursday evening	ground_service
please tell me how many nonstop flights there are from boston to atlanta	quantity
i need a flight from indianapolis to toronto reaching toronto on thursday morning	flight
what are the flights from new york city to las vegas	flight
can you show me evening flights from nashville to houston that serve dinner	flight
does midwest express serve indianapolis	flight
list all flights from nashville to seattle	flight
what are the flights from boston to san francisco	flight
what flights from indianapolis to memphis	flight
show me the flights from love field	flight
what ground transportation is there in atlanta	ground_service
what ground transportation is available in dallas	ground_service
show me the airlines between boston and toronto	airline
what are the first class fares from dallas to baltimore	airfare
what is the cheapest round trip coach flight between dallas and baltimore leaving august tenth	flight
list the cheapest round trip flights from orlando to kansas city	flight
show me flights from tampa to st. louis	flight
what ground transportation is available in baltimore for the day after tomorrow	ground_service
show me all flights from boston to denver	flight
show me all flights from philadelphia to boston on monday which serve a meal and arrive before noon	flight
i 'd like information on a flight from atlanta to denver a morning flight	flight
what flights go from denver to san francisco	flight
what flights leave after 7 pm from philadelphia to boston	flight
what are the fares for flights between atlanta and dfw provided by american airlines	airfare
flights from pittsburgh to baltimore between 10 am and 2 pm	flight
i need a flight from atlanta to charlotte north carolina next monday	flight
okay i 'd like to fly from denver to pittsburgh	flight
i want to fly from milwaukee to orlando	flight
how much is an economy ticket from washington to san francisco on september thirtieth	airfare
i 'd like to buy a coach class ticket from denver to atlanta with a stopover in pittsburgh	airfare
give me a flight from memphis to las vegas and new york city to las vegas on sunday that arrive at the same time	flight
a flight on continental airlines leaving boston and going to denver	flight
please book for me a flight on twa from washington dc to san francisco earliest possible time	flight
what flights are available between philadelphia and denver on september sixteenth	flight
which airlines serve atlanta	airline
i want to leave chicago next tuesday and arrive in detroit around 6 pm	flight
from toronto to atlanta in the afternoon	flight
how much is a flight from washington to boston	airfare
is there a flight on american airlines going from boston to san francisco on june twenty eighth	flight
from pittsburgh to baltimore	flight
what is ewr	abbreviation
what ground transportation is there in oakland	ground_service
i want a flight from atlanta to washington that leaves after 3 pm	flight
do you have an afternoon flight leaving in the afternoon going from boston to san francisco with a stopover in dallas	flight
i would like to see the flights from baltimore to philadelphia again	flight
what is restriction ap57	restriction
what does code y mean	abbreviation
do you have flights from st. petersburg to toronto on monday	flight
i would like a flight from philadelphia to dallas arrive dallas about 12 noon	flight
what aircraft is used on delta flight 1222 from kansas city to salt lake city	aircraft
what is the cost of a flight from boston to san francisco	airfare
ground transportation in phoenix	ground_service
on flight us air 2153 from san francisco to baltimore what time and what city does the plane stop in between	flight
show all flights from baltimore to dallas on monday evening and the cost of each flight	flight
how about april twenty seventh denver to washington	flight
list all nonstop flights from la to pittsburgh before 5 pm on tuesday	flight
now i 'd like a schedule for the flights on tuesday morning from oakland no from dallas fort worth to atlanta	flight_time
show me all the flights from montreal to detroit	flight
tell me about ground transportation in st. petersburg airport	ground_service
give me the continental flights from seattle	flight
show me the flights into love field	flight
does american airlines fly to san francisco from atlanta	flight
show me the cheapest fare from dallas to baltimore	airfare
show me the nonstop flights from dallas to houston	flight
i would like a flight from washington to boston on august twentieth at 324 pm	flight
what flights are provided by delta airlines	flight
show flights from dallas to oakland	flight
what are the different classes of service and the prices for us air	airfare
ground transportation in baltimore	ground_service
what flights go from san francisco to washington via indianapolis	flight
ground transportation for st. paul	ground_service
i would like a to know the type of aircraft leaving from atlanta bound to boston on friday this week	aircraft
which airlines have first class flights today	airline
flights from ontario to orlando	flight
what are all the flights into atlanta 's airport	flight
flights from baltimore to san francisco	flight
show me the flights from chicago to indianapolis	flight
give me flights from atlanta to baltimore	flight
please list the tuesday flights from atlanta to st. louis	flight
find the cheapest one way fare from boston to san francisco	airfare
boston to pittsburgh wednesday	flight
what does mco stand for	abbreviation
i want to fly from dallas to san francisco	flight
show me all flights from san diego to phoenix on a boeing 737	flight
