tokens	ner_tags	text
"['The', 'promoter', 'activity', 'was', 'measured', 'by', 'a', 'transient', 'expression', 'of', 'a', 'chloramphenicol', 'acetyltransferase', '(', 'CAT', ')', 'gene', 'connected', 'with', 'various', '5', ""'"", '-', 'deletion', 'mutants', 'of', 'the', '5', ""'"", '-', 'flanking', 'region', '.']"	['O', 'O', 'O', 'O', 'O', 'O', 'O', 'O', 'O', 'O', 'O', 'B-GENE', 'I-GENE', 'O', 'B-GENE', 'O', 'O', 'O', 'O', 'O', 'O', 'O', 'O', 'O', 'O', 'O', 'O', 'O', 'O', 'O', 'O', 'O', 'O']	The promoter activity was measured by a transient expression of a chloramphenicol acetyltransferase ( CAT ) gene connected with various 5 ' - deletion mutants of the 5 ' - flanking region .
['The', 'Saccharomyces', 'cerevisiae', '14DM', 'gene', ',', 'encoding', 'cytochrome', 'P450', 'lanosterol', '14', 'alpha', '-', 'demethylase', '(', '14DM', ')', ',', 'was', 'overexpressed', 'in', 'various', 'S', '.', 'cerevisiae', 'strains', 'under', 'the', 'control', 'of', 'three', 'strong', 'heterologous', 'yeast', 'transcription', 'promoters', '(', 'pADC1', ',', 'pGPD', ',', 'pPHO5', ')', 'and', 'under', 'the', 'control', 'of', 'its', 'own', 'promoter', '.']	['O', 'B-GENE', 'I-GENE', 'I-GENE', 'I-GENE', 'O', 'O', 'B-GENE', 'I-GENE', 'I-GENE', 'I-GENE', 'I-GENE', 'I-GENE', 'I-GENE', 'O', 'B-GENE', 'O', 'O', 'O', 'O', 'O', 'O', 'O', 'O', 'O', 'O', 'O', 'O', 'O', 'O', 'O', 'O', 'O', 'O', 'O', 'O', 'O', 'B-GENE', 'O', 'B-GENE', 'O', 'B-GENE', 'O', 'O', 'O', 'O', 'O', 'O', 'O', 'O', 'O', 'O']	The Saccharomyces cerevisiae 14DM gene , encoding cytochrome P450 lanosterol 14 alpha - demethylase ( 14DM ) , was overexpressed in various S . cerevisiae strains under the control of three strong heterologous yeast transcription promoters ( pADC1 , pGPD , pPHO5 ) and under the control of its own promoter .
['The', 'ANB1', 'locus', 'of', 'Saccharomyces', 'cerevisiae', 'encodes', 'the', 'protein', 'synthesis', 'initiation', 'factor', 'eIF', '-', '4D', '.']	['O', 'B-GENE', 'I-GENE', 'O', 'O', 'O', 'O', 'O', 'B-GENE', 'I-GENE', 'I-GENE', 'I-GENE', 'I-GENE', 'I-GENE', 'I-GENE', 'O']	The ANB1 locus of Saccharomyces cerevisiae encodes the protein synthesis initiation factor eIF - 4D .
['Specific', 'hyperimmune', 'globulins', 'to', 'pathogens', 'such', 'as', 'Haemophilus', 'influenzae', 'and', 'Streptococcus', 'pneumoniae', 'have', 'also', 'been', 'studied', '.']	['O', 'B-GENE', 'I-GENE', 'O', 'O', 'O', 'O', 'O', 'O', 'O', 'O', 'O', 'O', 'O', 'O', 'O', 'O']	Specific hyperimmune globulins to pathogens such as Haemophilus influenzae and Streptococcus pneumoniae have also been studied .
['Homozygous', 'individuals', 'usually', 'develop', 'purpura', 'fulminans', 'as', 'newborns', ';', 'heterozygous', 'protein', 'C', '-', 'deficient', 'individuals', 'are', 'at', 'increased', 'risk', 'for', 'venous', 'thrombosis', 'and', 'pulmonary', 'embolism', '.']	['O', 'O', 'O', 'O', 'O', 'O', 'O', 'O', 'O', 'O', 'B-GENE', 'I-GENE', 'O', 'O', 'O', 'O', 'O', 'O', 'O', 'O', 'O', 'O', 'O', 'O', 'O', 'O']	Homozygous individuals usually develop purpura fulminans as newborns ; heterozygous protein C - deficient individuals are at increased risk for venous thrombosis and pulmonary embolism .
['TREB7', 'and', 'TREB36', 'protected', 'all', 'three', 'repeats', 'of', 'the', '21', 'bp', ',', 'but', 'TREB5', 'protected', 'only', 'the', 'second', 'repeat', '.']	['B-GENE', 'O', 'B-GENE', 'O', 'O', 'O', 'O', 'O', 'O', 'O', 'O', 'O', 'O', 'B-GENE', 'O', 'O', 'O', 'O', 'O', 'O']	TREB7 and TREB36 protected all three repeats of the 21 bp , but TREB5 protected only the second repeat .
['Since', 'general', 'regulatory', 'factor', 'I', '(', 'GRFI', ')', '/', 'repressor', '/', 'activator', 'site', 'binding', 'protein', '1', '(', 'RAP1', ')', '/', 'translation', 'upstream', 'factor', '(', 'TUF', ')', 'is', 'believed', 'to', 'be', 'an', 'activator', 'of', 'MAT', 'alpha', 'expression', ',', 'we', 'examined', 'whether', 'PYK1', ',', 'which', 'is', 'known', 'to', 'be', 'regulated', 'by', 'GRFI', '/', 'RAP1', '/', 'TUF', ',', 'is', 'also', 'affected', 'by', 'the', 'gal11', 'mutation', '.']	['O', 'B-GENE', 'I-GENE', 'I-GENE', 'I-GENE', 'O', 'B-GENE', 'O', 'O', 'B-GENE', 'I-GENE', 'I-GENE', 'I-GENE', 'I-GENE', 'I-GENE', 'I-GENE', 'O', 'B-GENE', 'O', 'O', 'B-GENE', 'I-GENE', 'I-GENE', 'O', 'B-GENE', 'O', 'O', 'O', 'O', 'O', 'O', 'O', 'O', 'B-GENE', 'I-GENE', 'O', 'O', 'O', 'O', 'O', 'B-GENE', 'O', 'O', 'O', 'O', 'O', 'O', 'O', 'O', 'B-GENE', 'O', 'B-GENE', 'O', 'B-GENE', 'O', 'O', 'O', 'O', 'O', 'O', 'B-GENE', 'I-GENE', 'O']	Since general regulatory factor I ( GRFI ) / repressor / activator site binding protein 1 ( RAP1 ) / translation upstream factor ( TUF ) is believed to be an activator of MAT alpha expression , we examined whether PYK1 , which is known to be regulated by GRFI / RAP1 / TUF , is also affected by the gal11 mutation .
['In', 'vitro', 'transcription', 'extracts', 'from', 'ret1', '-', '1', 'cells', 'terminate', 'less', 'efficiently', 'at', 'weak', 'transcription', 'termination', 'signals', 'than', 'those', 'from', 'RET1', 'cells', ',', 'using', 'a', 'variety', 'of', 'tRNA', 'templates', '.']	['O', 'O', 'O', 'O', 'O', 'B-GENE', 'I-GENE', 'I-GENE', 'O', 'O', 'O', 'O', 'O', 'O', 'O', 'O', 'O', 'O', 'O', 'O', 'B-GENE', 'O', 'O', 'O', 'O', 'O', 'O', 'O', 'O', 'O']	In vitro transcription extracts from ret1 - 1 cells terminate less efficiently at weak transcription termination signals than those from RET1 cells , using a variety of tRNA templates .
['These', 'factors', 'belong', 'to', 'a', 'set', 'of', 'genetically', 'distinct', 'molecules', ',', 'including', 'AP', '-', '4', 'and', 'MLTF', ',', 'that', 'bind', 'to', 'the', 'CACCTGTC', 'motif', 'or', 'related', 'sequences', '.']	['O', 'O', 'O', 'O', 'O', 'O', 'O', 'O', 'O', 'O', 'O', 'O', 'B-GENE', 'I-GENE', 'I-GENE', 'O', 'B-GENE', 'O', 'O', 'O', 'O', 'O', 'O', 'O', 'O', 'O', 'O', 'O']	These factors belong to a set of genetically distinct molecules , including AP - 4 and MLTF , that bind to the CACCTGTC motif or related sequences .
"['RNase', 'protection', 'assays', 'reveal', 'that', 'this', 'gene', ',', 'unr', ',', 'is', 'transcribed', 'in', 'the', 'same', 'direction', 'as', 'N', '-', 'ras', 'and', 'that', 'its', '3', ""'"", 'end', 'is', 'located', 'just', '130', 'base', 'pairs', 'away', 'from', 'the', 'point', 'at', 'which', 'N', '-', 'ras', 'transcription', 'begins', '.']"	['B-GENE', 'O', 'O', 'O', 'O', 'O', 'O', 'O', 'B-GENE', 'O', 'O', 'O', 'O', 'O', 'O', 'O', 'O', 'B-GENE', 'I-GENE', 'I-GENE', 'O', 'O', 'O', 'O', 'O', 'O', 'O', 'O', 'O', 'O', 'O', 'O', 'O', 'O', 'O', 'O', 'O', 'O', 'B-GENE', 'I-GENE', 'I-GENE', 'O', 'O', 'O']	RNase protection assays reveal that this gene , unr , is transcribed in the same direction as N - ras and that its 3 ' end is located just 130 base pairs away from the point at which N - ras transcription begins .
['The', 'juxtamembrane', 'region', 'of', 'the', 'insulin', 'receptor', '(', 'IR', ')', 'beta', '-', 'subunit', 'contains', 'an', 'unphosphorylated', 'tyrosyl', 'residue', '(', 'Tyr960', ')', 'that', 'is', 'essential', 'for', 'insulin', '-', 'stimulated', 'tyrosyl', 'phosphorylation', 'of', 'some', 'endogenous', 'substrates', 'and', 'certain', 'biological', 'responses', '(', 'White', ',', 'M', '.', 'F', '.', ',', 'Livingston', ',', 'J', '.', 'N', '.', ',', 'Backer', ',', 'J', '.', 'M', '.', ',', 'Lauris', ',', 'V', '.', ',', 'Dull', ',', 'T', '.', 'J', '.', ',', 'Ullrich', ',', 'A', '.', ',', 'and', 'Kahn', ',', 'C', '.', 'R', '.']	['O', 'O', 'O', 'O', 'O', 'B-GENE', 'I-GENE', 'I-GENE', 'I-GENE', 'I-GENE', 'I-GENE', 'I-GENE', 'I-GENE', 'O', 'O', 'O', 'O', 'O', 'O', 'O', 'O', 'O', 'O', 'O', 'O', 'B-GENE', 'O', 'O', 'O', 'O', 'O', 'O', 'O', 'O', 'O', 'O', 'O', 'O', 'O', 'O', 'O', 'O', 'O', 'O', 'O', 'O', 'O', 'O', 'O', 'O', 'O', 'O', 'O', 'O', 'O', 'O', 'O', 'O', 'O', 'O', 'O', 'O', 'O', 'O', 'O', 'O', 'O', 'O', 'O', 'O', 'O', 'O', 'O', 'O', 'O', 'O', 'O', 'O', 'O', 'O', 'O', 'O', 'O', 'O']	The juxtamembrane region of the insulin receptor ( IR ) beta - subunit contains an unphosphorylated tyrosyl residue ( Tyr960 ) that is essential for insulin - stimulated tyrosyl phosphorylation of some endogenous substrates and certain biological responses ( White , M . F . , Livingston , J . N . , Backer , J . M . , Lauris , V . , Dull , T . J . , Ullrich , A . , and Kahn , C . R .
['This', 'gene', 'joins', 'the', 'group', 'of', 'genes', 'whose', 'members', 'are', 'rapidly', 'transcribed', 'in', 'response', 'to', 'insulin', 'and', 'other', 'mitogens', '.']	['O', 'O', 'O', 'O', 'O', 'O', 'O', 'O', 'O', 'O', 'O', 'O', 'O', 'O', 'O', 'B-GENE', 'O', 'O', 'O', 'O']	This gene joins the group of genes whose members are rapidly transcribed in response to insulin and other mitogens .
['Homozygous', 'protein', 'C', '(', 'PC', ')', 'deficiency', 'is', 'reported', 'in', 'two', 'siblings', '(', 'girl', 'and', 'boy', ')', 'who', 'received', 'their', 'proper', 'diagnoses', 'at', 'the', 'ages', 'of', '7', '4', '/', '12', 'and', '1', '3', '/', '12', 'years', 'respectively', '.']	['O', 'B-GENE', 'I-GENE', 'O', 'B-GENE', 'O', 'O', 'O', 'O', 'O', 'O', 'O', 'O', 'O', 'O', 'O', 'O', 'O', 'O', 'O', 'O', 'O', 'O', 'O', 'O', 'O', 'O', 'O', 'O', 'O', 'O', 'O', 'O', 'O', 'O', 'O', 'O', 'O']	Homozygous protein C ( PC ) deficiency is reported in two siblings ( girl and boy ) who received their proper diagnoses at the ages of 7 4 / 12 and 1 3 / 12 years respectively .
['Within', 'this', 'sequence', 'the', 'MSAS', 'gene', 'was', 'identified', 'as', 'a', '5322', '-', 'bp', '-', 'long', 'open', 'reading', 'frame', 'coding', 'for', 'a', 'protein', 'of', '1774', 'amino', 'acids', 'and', '190', ',', '731', 'Da', 'molecular', 'mass', '.']	['O', 'O', 'O', 'O', 'B-GENE', 'I-GENE', 'O', 'O', 'O', 'O', 'O', 'O', 'O', 'O', 'O', 'O', 'O', 'O', 'O', 'O', 'O', 'O', 'O', 'O', 'O', 'O', 'O', 'O', 'O', 'O', 'O', 'O', 'O', 'O']	Within this sequence the MSAS gene was identified as a 5322 - bp - long open reading frame coding for a protein of 1774 amino acids and 190 , 731 Da molecular mass .
['The', 'interrelation', 'of', 'the', 'levels', 'of', 'glucocorticoids', 'and', 'insulin', 'in', 'the', 'blood', 'of', 'irradiated', 'animals']	['O', 'O', 'O', 'O', 'O', 'O', 'O', 'O', 'B-GENE', 'O', 'O', 'O', 'O', 'O', 'O']	The interrelation of the levels of glucocorticoids and insulin in the blood of irradiated animals
['Primer', 'extension', 'analysis', 'and', 'RNA', 'sequencing', 'demonstrates', 'that', 'the', 'transcription', 'start', 'point', 'of', 'rat', 'ODC', 'mRNA', 'is', 'located', '303', 'nt', 'upstream', 'from', 'the', 'A', 'residue', 'in', 'the', 'start', 'codon', '.']	['O', 'O', 'O', 'O', 'O', 'O', 'O', 'O', 'O', 'O', 'O', 'O', 'O', 'B-GENE', 'I-GENE', 'I-GENE', 'O', 'O', 'O', 'O', 'O', 'O', 'O', 'O', 'O', 'O', 'O', 'O', 'O', 'O']	Primer extension analysis and RNA sequencing demonstrates that the transcription start point of rat ODC mRNA is located 303 nt upstream from the A residue in the start codon .
['These', 'results', 'indicate', 'that', 'the', 'cis', '-', 'regulatory', 'elements', 'required', 'for', 'developmental', 'control', 'of', 'the', 'HaG3', '-', 'A', 'helianthinin', 'gene', 'are', 'located', 'in', 'a', '2', '.', '4', 'kb', 'upstream', 'region', 'of', 'this', 'gene', '.']	['O', 'O', 'O', 'O', 'O', 'O', 'O', 'O', 'O', 'O', 'O', 'O', 'O', 'O', 'O', 'B-GENE', 'I-GENE', 'I-GENE', 'I-GENE', 'I-GENE', 'O', 'O', 'O', 'O', 'O', 'O', 'O', 'O', 'O', 'O', 'O', 'O', 'O', 'O']	These results indicate that the cis - regulatory elements required for developmental control of the HaG3 - A helianthinin gene are located in a 2 . 4 kb upstream region of this gene .
['Some', 'mutations', 'affected', 'Dhfr', 'in', 'a', 'qualitative', 'manner', ',', 'such', 'as', 'by', 'changing', 'the', 'startpoint', 'of', 'one', 'of', 'the', 'major', 'Dhfr', 'transcripts', 'or', 'changing', 'the', 'relative', 'abundance', 'of', 'the', 'two', 'major', 'Dhfr', 'transcripts', '.']	['O', 'O', 'O', 'B-GENE', 'O', 'O', 'O', 'O', 'O', 'O', 'O', 'O', 'O', 'O', 'O', 'O', 'O', 'O', 'O', 'O', 'B-GENE', 'I-GENE', 'O', 'O', 'O', 'O', 'O', 'O', 'O', 'O', 'O', 'B-GENE', 'I-GENE', 'O']	Some mutations affected Dhfr in a qualitative manner , such as by changing the startpoint of one of the major Dhfr transcripts or changing the relative abundance of the two major Dhfr transcripts .
['As', 'in', 'mammals', ',', 'considerable', 'nucleotide', 'diversity', 'was', 'observed', 'at', 'the', 'junctions', 'of', 'the', 'variable', ',', 'diversity', ',', 'and', 'joining', 'elements', 'in', 'chicken', 'TCR', 'beta', 'cDNAs', '.']	['O', 'O', 'O', 'O', 'O', 'O', 'O', 'O', 'O', 'O', 'O', 'O', 'O', 'O', 'O', 'O', 'O', 'O', 'O', 'O', 'O', 'O', 'B-GENE', 'I-GENE', 'I-GENE', 'I-GENE', 'O']	As in mammals , considerable nucleotide diversity was observed at the junctions of the variable , diversity , and joining elements in chicken TCR beta cDNAs .
['S6', 'kinase', 'activation', 'requires', 'displacement', 'of', 'this', 'inhibitory', 'segment', ',', 'which', 'is', 'proposed', 'to', 'occur', 'consequent', 'to', 'its', 'multiple', 'phosphorylation', '.']	['B-GENE', 'I-GENE', 'O', 'O', 'O', 'O', 'O', 'O', 'O', 'O', 'O', 'O', 'O', 'O', 'O', 'O', 'O', 'O', 'O', 'O', 'O']	S6 kinase activation requires displacement of this inhibitory segment , which is proposed to occur consequent to its multiple phosphorylation .
['The', 'SUP44', 'suppressor', 'mutation', 'occurs', 'near', 'a', 'region', 'of', 'the', 'protein', 'that', 'corresponds', 'to', 'the', 'known', 'positions', 'of', 'alterations', 'in', 'E', '.', 'coli', 'S5', 'ram', 'mutations', '.']	['O', 'B-GENE', 'I-GENE', 'I-GENE', 'O', 'O', 'O', 'O', 'O', 'O', 'O', 'O', 'O', 'O', 'O', 'O', 'O', 'O', 'O', 'O', 'B-GENE', 'I-GENE', 'I-GENE', 'I-GENE', 'I-GENE', 'I-GENE', 'O']	The SUP44 suppressor mutation occurs near a region of the protein that corresponds to the known positions of alterations in E . coli S5 ram mutations .
['Results', 'have', 'surprisingly', 'revealed', 'the', 'presence', 'of', 'three', 'U14', 'snRNA', '-', 'homologous', 'regions', 'positioned', 'within', 'introns', '5', ',', '6', ',', 'and', '8', 'of', 'the', 'mouse', 'cognate', 'hsc70', 'heat', 'shock', 'gene', '.']	['O', 'O', 'O', 'O', 'O', 'O', 'O', 'O', 'B-GENE', 'I-GENE', 'I-GENE', 'I-GENE', 'I-GENE', 'O', 'O', 'O', 'O', 'O', 'O', 'O', 'O', 'O', 'O', 'O', 'O', 'O', 'B-GENE', 'O', 'O', 'O', 'O']	Results have surprisingly revealed the presence of three U14 snRNA - homologous regions positioned within introns 5 , 6 , and 8 of the mouse cognate hsc70 heat shock gene .
['65', '-', 'kilodalton', 'protein', 'phosphorylated', 'by', 'interleukin', '2', 'stimulation', 'bears', 'two', 'putative', 'actin', '-', 'binding', 'sites', 'and', 'two', 'calcium', '-', 'binding', 'sites', '.']	['O', 'O', 'O', 'O', 'O', 'O', 'B-GENE', 'I-GENE', 'O', 'O', 'O', 'O', 'B-GENE', 'I-GENE', 'I-GENE', 'I-GENE', 'O', 'O', 'O', 'O', 'O', 'O', 'O']	65 - kilodalton protein phosphorylated by interleukin 2 stimulation bears two putative actin - binding sites and two calcium - binding sites .
['Serum', 'Fibrin', 'Degradation', 'Products', '(', 'FDP', ')', 'were', 'determined', 'in', '50', 'oral', 'cancer', 'patients', 'and', '50', 'normal', 'individuals', 'prior', 'to', 'any', 'kind', 'of', 'treatment', '.']	['O', 'B-GENE', 'I-GENE', 'I-GENE', 'O', 'B-GENE', 'O', 'O', 'O', 'O', 'O', 'O', 'O', 'O', 'O', 'O', 'O', 'O', 'O', 'O', 'O', 'O', 'O', 'O', 'O']	Serum Fibrin Degradation Products ( FDP ) were determined in 50 oral cancer patients and 50 normal individuals prior to any kind of treatment .
['The', 'mean', 'change', 'in', 'HbA1', ',', 'adjusted', 'for', 'the', 'initial', 'value', ',', 'was', '-', '0', '.', '4', '%', 'in', 'the', 'experimental', 'and', '+', '0', '.', '5', '%', 'in', 'the', 'control', 'group', '(', 'p', 'less', 'than', '0', '.', '05', ')', '.']	['O', 'O', 'O', 'O', 'B-GENE', 'O', 'O', 'O', 'O', 'O', 'O', 'O', 'O', 'O', 'O', 'O', 'O', 'O', 'O', 'O', 'O', 'O', 'O', 'O', 'O', 'O', 'O', 'O', 'O', 'O', 'O', 'O', 'O', 'O', 'O', 'O', 'O', 'O', 'O', 'O']	The mean change in HbA1 , adjusted for the initial value , was - 0 . 4 % in the experimental and + 0 . 5 % in the control group ( p less than 0 . 05 ) .
['Effect', 'of', 'biliary', 'obstruction', 'and', 'cholangitis', 'on', 'serum', 'SPan', '-', '1', 'level']	['O', 'O', 'O', 'O', 'O', 'O', 'O', 'B-GENE', 'I-GENE', 'I-GENE', 'I-GENE', 'O']	Effect of biliary obstruction and cholangitis on serum SPan - 1 level
['By', 'introducing', 'a', 'series', 'of', 'deletions', 'in', 'the', 'vimentin', 'promoter', ',', 'we', 'further', 'restrict', 'these', 'sequences', 'to', '30', 'base', 'pairs', ',', 'located', 'between', '241', 'and', '210', 'base', 'pairs', 'upstream', 'of', 'the', 'mRNA', 'cap', 'site', '.']	['O', 'O', 'O', 'O', 'O', 'O', 'O', 'O', 'B-GENE', 'O', 'O', 'O', 'O', 'O', 'O', 'O', 'O', 'O', 'O', 'O', 'O', 'O', 'O', 'O', 'O', 'O', 'O', 'O', 'O', 'O', 'O', 'O', 'O', 'O', 'O']	By introducing a series of deletions in the vimentin promoter , we further restrict these sequences to 30 base pairs , located between 241 and 210 base pairs upstream of the mRNA cap site .
['All', '89', 'participating', 'household', 'members', 'were', 'anti', '-', 'HIV', 'seronegative', ',', 'and', '78', 'who', 'were', 'tested', 'were', 'serum', 'p24', 'antigen', 'negative', '.']	['O', 'O', 'O', 'O', 'O', 'O', 'B-GENE', 'I-GENE', 'I-GENE', 'O', 'O', 'O', 'O', 'O', 'O', 'O', 'O', 'B-GENE', 'I-GENE', 'I-GENE', 'O', 'O']	All 89 participating household members were anti - HIV seronegative , and 78 who were tested were serum p24 antigen negative .
"['To', 'define', 'the', 'mechanism', 'responsible', 'for', 'the', 'loss', 'of', 'transcription', 'elongation', 'blockage', 'and', 'resulting', 'c', '-', 'myc', 'deregulation', 'in', 'Burkitt', ""'"", 's', 'lymphoma', ',', 'we', 'analyzed', 'transcription', 'patterns', 'after', 'transfer', 'of', 'normal', 'and', 'Burkitt', ""'"", 's', 'lymphoma', 'c', '-', 'myc', 'alleles', 'into', 'murine', 'cells', 'and', 'Xenopus', 'oocyte', 'germinal', 'vesicles', '.']"	['O', 'O', 'O', 'O', 'O', 'O', 'O', 'O', 'O', 'O', 'O', 'O', 'O', 'O', 'B-GENE', 'I-GENE', 'I-GENE', 'O', 'O', 'O', 'O', 'O', 'O', 'O', 'O', 'O', 'O', 'O', 'O', 'O', 'O', 'O', 'O', 'O', 'O', 'O', 'O', 'B-GENE', 'I-GENE', 'I-GENE', 'O', 'O', 'O', 'O', 'O', 'O', 'O', 'O', 'O', 'O']	To define the mechanism responsible for the loss of transcription elongation blockage and resulting c - myc deregulation in Burkitt ' s lymphoma , we analyzed transcription patterns after transfer of normal and Burkitt ' s lymphoma c - myc alleles into murine cells and Xenopus oocyte germinal vesicles .
['From', 'an', 'RNK', '-', '16', 'lambda', '-', 'gt11', 'library', ',', 'we', 'have', 'isolated', 'and', 'sequenced', 'a', 'novel', 'cDNA', 'rat', 'NK', 'cell', 'protease', '1', '(', 'RNKP', '-', '1', ')', 'that', 'has', 'characteristics', 'unique', 'to', 'serine', 'proteases', '.']	['O', 'O', 'O', 'O', 'O', 'O', 'O', 'O', 'O', 'O', 'O', 'O', 'O', 'O', 'O', 'O', 'O', 'O', 'B-GENE', 'I-GENE', 'I-GENE', 'I-GENE', 'I-GENE', 'O', 'B-GENE', 'I-GENE', 'I-GENE', 'O', 'O', 'O', 'O', 'O', 'O', 'B-GENE', 'I-GENE', 'O']	From an RNK - 16 lambda - gt11 library , we have isolated and sequenced a novel cDNA rat NK cell protease 1 ( RNKP - 1 ) that has characteristics unique to serine proteases .
['Patients', 'with', 'acute', 'myocardial', 'infarction', 'had', 'higher', 'plasma', 'concentrations', 'of', 'neutrophil', 'elastase', 'and', 'the', 'non', '-', 'peroxide', 'diene', 'conjugated', 'isomer', 'of', 'linoleic', 'acid', 'than', 'normal', 'volunteers', 'or', 'patients', 'with', 'stable', 'ischaemic', 'heart', 'disease', '.']	['O', 'O', 'O', 'O', 'O', 'O', 'O', 'O', 'O', 'O', 'B-GENE', 'I-GENE', 'O', 'O', 'O', 'O', 'O', 'O', 'O', 'O', 'O', 'O', 'O', 'O', 'O', 'O', 'O', 'O', 'O', 'O', 'O', 'O', 'O', 'O']	Patients with acute myocardial infarction had higher plasma concentrations of neutrophil elastase and the non - peroxide diene conjugated isomer of linoleic acid than normal volunteers or patients with stable ischaemic heart disease .
['TMBr', '-', '1', 'is', 'identical', 'to', 'striated', 'muscle', 'alpha', '-', 'tropomyosin', 'from', 'amino', 'acids', '1', 'through', '258', 'but', 'contains', 'a', 'novel', 'COOH', '-', 'terminal', 'region', 'from', 'amino', 'acids', '259', 'through', '281', '.']	['B-GENE', 'I-GENE', 'I-GENE', 'O', 'O', 'O', 'B-GENE', 'I-GENE', 'I-GENE', 'I-GENE', 'I-GENE', 'O', 'O', 'O', 'O', 'O', 'O', 'O', 'O', 'O', 'O', 'O', 'O', 'O', 'O', 'O', 'O', 'O', 'O', 'O', 'O', 'O']	TMBr - 1 is identical to striated muscle alpha - tropomyosin from amino acids 1 through 258 but contains a novel COOH - terminal region from amino acids 259 through 281 .
['Comparison', 'of', 'transmembrane', 'and', 'cytoplasmic', 'domains', 'to', 'a', 'third', 'cell', '-', 'surface', 'proteoglycan', ',', '48K5', 'from', 'human', 'lung', 'fibroblasts', '(', 'Marynen', ',', 'P', '.', ',', 'Zhang', ',', 'J', '.', ',', 'Cassiman', ',', 'J', '.', ',', 'Vanden', 'Berghe', ',', 'H', '.', ',', 'and', 'David', ',', 'C', '.']	['O', 'O', 'O', 'O', 'O', 'O', 'O', 'O', 'O', 'O', 'O', 'O', 'O', 'O', 'B-GENE', 'O', 'O', 'O', 'O', 'O', 'O', 'O', 'O', 'O', 'O', 'O', 'O', 'O', 'O', 'O', 'O', 'O', 'O', 'O', 'O', 'O', 'O', 'O', 'O', 'O', 'O', 'O', 'O', 'O', 'O', 'O']	Comparison of transmembrane and cytoplasmic domains to a third cell - surface proteoglycan , 48K5 from human lung fibroblasts ( Marynen , P . , Zhang , J . , Cassiman , J . , Vanden Berghe , H . , and David , C .
['High', 'levels', 'of', 'C', 'subunits', 'are', 'observed', 'in', 'several', 'subsequent', 'larval', 'and', 'adult', 'stages', 'of', 'development', '.']	['O', 'O', 'O', 'B-GENE', 'I-GENE', 'O', 'O', 'O', 'O', 'O', 'O', 'O', 'O', 'O', 'O', 'O', 'O']	High levels of C subunits are observed in several subsequent larval and adult stages of development .
['Plasma', 'lecithin', '/', 'cholesterol', 'acyltransferase', '(', 'LCAT', ')', 'activity', 'in', 'multiple', '-', 'organ', 'donors', ':', 'a', 'predictor', 'of', 'allograft', 'viability', 'in', 'clinical', 'liver', 'transplantation', '.']	['O', 'B-GENE', 'I-GENE', 'I-GENE', 'I-GENE', 'O', 'B-GENE', 'O', 'O', 'O', 'O', 'O', 'O', 'O', 'O', 'O', 'O', 'O', 'O', 'O', 'O', 'O', 'O', 'O', 'O']	Plasma lecithin / cholesterol acyltransferase ( LCAT ) activity in multiple - organ donors : a predictor of allograft viability in clinical liver transplantation .
['Expression', ',', 'cellular', 'localization', 'and', 'in', 'vitro', 'transcription', 'studies', 'establish', 'that', 'cloned', 'hUBF', 'encodes', 'a', 'nucleolar', 'factor', 'that', 'binds', 'specifically', 'to', 'the', 'upstream', 'control', 'element', 'and', 'core', 'of', 'the', 'rRNA', 'gene', 'promoter', 'to', 'activate', 'transcription', 'in', 'a', 'binding', 'site', '-', 'dependent', 'manner', '.']	['O', 'O', 'O', 'O', 'O', 'O', 'O', 'O', 'O', 'O', 'O', 'B-GENE', 'I-GENE', 'O', 'O', 'O', 'O', 'O', 'O', 'O', 'O', 'O', 'O', 'O', 'O', 'O', 'O', 'O', 'O', 'O', 'O', 'O', 'O', 'O', 'O', 'O', 'O', 'O', 'O', 'O', 'O', 'O', 'O']	Expression , cellular localization and in vitro transcription studies establish that cloned hUBF encodes a nucleolar factor that binds specifically to the upstream control element and core of the rRNA gene promoter to activate transcription in a binding site - dependent manner .
['The', 'distribution', 'of', 'their', 'fibrinogen', 'levels', 'was', 'Gaussian', ',', 'but', 'more', 'wide', '-', 'based', 'than', 'the', 'distribution', 'of', 'our', 'normal', 'controls', '.']	['O', 'O', 'O', 'O', 'B-GENE', 'O', 'O', 'O', 'O', 'O', 'O', 'O', 'O', 'O', 'O', 'O', 'O', 'O', 'O', 'O', 'O', 'O']	The distribution of their fibrinogen levels was Gaussian , but more wide - based than the distribution of our normal controls .
['An', 'NF1', '-', 'related', 'vitellogenin', 'activator', 'element', 'mediates', 'transcription', 'from', 'the', 'estrogen', '-', 'regulated', 'Xenopus', 'laevis', 'vitellogenin', 'promoter', '.']	['O', 'B-GENE', 'I-GENE', 'I-GENE', 'I-GENE', 'I-GENE', 'I-GENE', 'O', 'O', 'O', 'O', 'O', 'O', 'O', 'B-GENE', 'I-GENE', 'I-GENE', 'I-GENE', 'O']	An NF1 - related vitellogenin activator element mediates transcription from the estrogen - regulated Xenopus laevis vitellogenin promoter .
['These', 'findings', 'indicate', 'that', 'hypergastrinemia', 'induced', 'by', 'surgical', 'removal', 'of', 'acid', '-', 'producing', 'mucosa', 'in', 'the', 'rat', 'has', 'the', 'same', 'effects', 'on', 'oxyntical', 'mucosal', 'HDC', 'activity', ',', 'histamine', 'concentration', 'and', 'ECL', 'cell', 'density', 'as', 'hypergastrinemia', 'induced', 'by', 'continuous', 'gastrin', 'infusion', 'or', 'by', 'long', '-', 'term', 'treatment', 'with', 'effective', 'antisecretagogues', '.']	['O', 'O', 'O', 'O', 'O', 'O', 'O', 'O', 'O', 'O', 'O', 'O', 'O', 'O', 'O', 'O', 'O', 'O', 'O', 'O', 'O', 'O', 'O', 'B-GENE', 'I-GENE', 'O', 'O', 'O', 'O', 'O', 'O', 'O', 'O', 'O', 'O', 'O', 'O', 'O', 'B-GENE', 'O', 'O', 'O', 'O', 'O', 'O', 'O', 'O', 'O', 'O', 'O']	These findings indicate that hypergastrinemia induced by surgical removal of acid - producing mucosa in the rat has the same effects on oxyntical mucosal HDC activity , histamine concentration and ECL cell density as hypergastrinemia induced by continuous gastrin infusion or by long - term treatment with effective antisecretagogues .
['A', 'consensus', 'binding', 'site', 'for', 'the', 'transcription', 'factor', 'SP1', 'was', 'identified', 'in', 'intron', 'As', 'downstream', 'of', 'the', 'proenkephalin', 'germ', 'cell', 'cap', 'site', 'region', '.']	['O', 'O', 'O', 'O', 'O', 'O', 'O', 'O', 'B-GENE', 'O', 'O', 'O', 'O', 'O', 'O', 'O', 'O', 'B-GENE', 'I-GENE', 'I-GENE', 'I-GENE', 'I-GENE', 'I-GENE', 'O']	A consensus binding site for the transcription factor SP1 was identified in intron As downstream of the proenkephalin germ cell cap site region .
