tokens	ner_tags	text
['A', 'controlled', 'trial', 'of', 'recombinant', 'human', 'granulocyte', '-', 'macrophage', 'colony', '-', 'stimulating', 'factor', 'after', 'total', 'body', 'irradiation', ',', 'high', '-', 'dose', 'chemotherapy', ',', 'and', 'autologous', 'bone', 'marrow', 'transplantation', 'for', 'acute', 'lymphoblastic', 'leukemia', 'or', 'malignant', 'lymphoma', '.']	['O', 'O', 'O', 'O', 'B-GENE', 'I-GENE', 'I-GENE', 'I-GENE', 'I-GENE', 'I-GENE', 'I-GENE', 'I-GENE', 'I-GENE', 'O', 'O', 'O', 'O', 'O', 'O', 'O', 'O', 'O', 'O', 'O', 'O', 'O', 'O', 'O', 'O', 'O', 'O', 'O', 'O', 'O', 'O', 'O']	A controlled trial of recombinant human granulocyte - macrophage colony - stimulating factor after total body irradiation , high - dose chemotherapy , and autologous bone marrow transplantation for acute lymphoblastic leukemia or malignant lymphoma .
['Examination', 'of', 'ANCA', 'is', 'not', 'only', 'a', 'significant', 'contribution', 'towards', 'a', 'more', 'accurate', 'diagnosis', 'of', 'renal', 'vasculitis', ',', 'but', 'also', 'an', 'indicator', 'of', 'the', 'activity', 'of', 'the', 'disease', 'and', 'thus', 'of', 'the', 'effectiveness', 'of', 'immunosuppressive', 'treatment', '.']	['O', 'O', 'B-GENE', 'O', 'O', 'O', 'O', 'O', 'O', 'O', 'O', 'O', 'O', 'O', 'O', 'O', 'O', 'O', 'O', 'O', 'O', 'O', 'O', 'O', 'O', 'O', 'O', 'O', 'O', 'O', 'O', 'O', 'O', 'O', 'O', 'O', 'O']	Examination of ANCA is not only a significant contribution towards a more accurate diagnosis of renal vasculitis , but also an indicator of the activity of the disease and thus of the effectiveness of immunosuppressive treatment .
['The', 'distinguishing', 'features', 'involved', 'eight', 'amino', 'acid', 'changes', ',', 'including', 'a', 'single', 'lysine', 'deletion', 'relative', 'to', 'a', 'primate', 'consensus', 'sequence', 'in', 'the', 'first', 'complementary', '-', 'determing', 'region', 'of', 'V1J1', '.']	['O', 'O', 'O', 'O', 'O', 'O', 'O', 'O', 'O', 'O', 'O', 'O', 'O', 'O', 'O', 'O', 'O', 'O', 'O', 'O', 'O', 'O', 'O', 'O', 'O', 'O', 'O', 'O', 'B-GENE', 'O']	The distinguishing features involved eight amino acid changes , including a single lysine deletion relative to a primate consensus sequence in the first complementary - determing region of V1J1 .
['On', 'the', 'basis', 'of', 'these', 'unique', 'properties', ',', 'the', 'newly', 'characterized', 'hemagglutinin', 'has', 'been', 'termed', 'Limulus', '18K', 'agglutination', '-', 'aggregation', 'factor', '(', '18K', '-', 'LAF', ')', '.']	['O', 'O', 'O', 'O', 'O', 'O', 'O', 'O', 'O', 'O', 'O', 'B-GENE', 'O', 'O', 'O', 'B-GENE', 'I-GENE', 'I-GENE', 'I-GENE', 'I-GENE', 'I-GENE', 'O', 'B-GENE', 'I-GENE', 'I-GENE', 'O', 'O']	On the basis of these unique properties , the newly characterized hemagglutinin has been termed Limulus 18K agglutination - aggregation factor ( 18K - LAF ) .
['The', 'shift', 'to', 'the', 'nonpermissive', 'temperature', 'is', 'accompanied', 'by', 'the', 'loss', 'of', 'guanyl', 'nucleotide', '-', 'dependent', 'activity', 'of', 'adenylylcyclase', 'in', 'vitro', '.']	['O', 'O', 'O', 'O', 'O', 'O', 'O', 'O', 'O', 'O', 'O', 'O', 'O', 'O', 'O', 'O', 'O', 'O', 'B-GENE', 'O', 'O', 'O']	The shift to the nonpermissive temperature is accompanied by the loss of guanyl nucleotide - dependent activity of adenylylcyclase in vitro .
['It', 'corresponds', 'to', 'the', 'complete', 'mitochondrial', 'presequence', 'and', 'the', 'lipoyl', '-', 'bearing', 'domain', 'that', 'are', 'encoded', 'by', 'exons', 'I', 'through', 'IV', 'of', 'the', 'functional', 'E2', 'gene', '.']	['O', 'O', 'O', 'O', 'O', 'O', 'O', 'O', 'O', 'O', 'O', 'O', 'O', 'O', 'O', 'O', 'O', 'O', 'O', 'O', 'O', 'O', 'O', 'O', 'B-GENE', 'I-GENE', 'O']	It corresponds to the complete mitochondrial presequence and the lipoyl - bearing domain that are encoded by exons I through IV of the functional E2 gene .
['According', 'to', 'out', 'field', 'research', ',', 'the', 'tick', 'fauna', 'was', 'very', 'rich', 'throughout', 'that', 'area', ',', 'and', 'it', 'was', 'permissible', 'enough', 'to', 'determine', 'ticks', 'as', 'the', 'vectors', ',', 'based', 'on', 'arising', 'of', 'anti', '-', 'SF', 'group', 'rickettsiae', '(', 'SFGR', ')', 'antibody', 'in', 'mice', 'inoculated', 'with', 'some', 'tick', 'emulsions', ',', 'findings', 'of', 'rickettsiae', 'reactive', 'to', 'patient', 'sera', 'or', 'a', 'species', '-', 'specific', 'monoclonal', 'antibody', 'to', 'JSFR', 'in', 'the', 'hemolymph', 'cells', 'of', 'some', 'ticks', ',', 'and', 'electron', 'microscopical', 'observations', 'of', 'SFGR', 'in', 'various', 'internal', 'organs', 'including', 'the', 'salivary', 'gland', 'of', 'ticks', '.']	['O', 'O', 'O', 'O', 'O', 'O', 'O', 'O', 'O', 'O', 'O', 'O', 'O', 'O', 'O', 'O', 'O', 'O', 'O', 'O', 'O', 'O', 'O', 'O', 'O', 'O', 'O', 'O', 'O', 'O', 'O', 'O', 'B-GENE', 'I-GENE', 'I-GENE', 'I-GENE', 'I-GENE', 'O', 'B-GENE', 'O', 'O', 'O', 'O', 'O', 'O', 'O', 'O', 'O', 'O', 'O', 'O', 'O', 'O', 'O', 'O', 'O', 'O', 'O', 'O', 'O', 'O', 'O', 'O', 'O', 'B-GENE', 'O', 'O', 'O', 'O', 'O', 'O', 'O', 'O', 'O', 'O', 'O', 'O', 'O', 'B-GENE', 'O', 'O', 'O', 'O', 'O', 'O', 'O', 'O', 'O', 'O', 'O']	According to out field research , the tick fauna was very rich throughout that area , and it was permissible enough to determine ticks as the vectors , based on arising of anti - SF group rickettsiae ( SFGR ) antibody in mice inoculated with some tick emulsions , findings of rickettsiae reactive to patient sera or a species - specific monoclonal antibody to JSFR in the hemolymph cells of some ticks , and electron microscopical observations of SFGR in various internal organs including the salivary gland of ticks .
['Nucleotide', 'sequence', 'and', 'transcriptional', 'analysis', 'of', 'the', 'polyhedrin', 'gene', 'of', 'Spodoptera', 'exigua', 'nuclear', 'polyhedrosis', 'virus', '.']	['O', 'O', 'O', 'O', 'O', 'O', 'O', 'B-GENE', 'I-GENE', 'O', 'O', 'O', 'O', 'O', 'O', 'O']	Nucleotide sequence and transcriptional analysis of the polyhedrin gene of Spodoptera exigua nuclear polyhedrosis virus .
['Subcutaneous', 'administration', 'of', 'the', 'somatostatin', 'analogue', ',', 'octreotide', ',', '100', 'micrograms', 'thrice', 'daily', ',', 'resulted', 'in', 'a', 'sustained', 'improvement', 'in', 'diarrhoea', 'and', 'disappearance', 'of', 'faecal', 'incontinence', 'without', 'reducing', 'calcitonin', 'levels', '.']	['O', 'O', 'O', 'O', 'B-GENE', 'O', 'O', 'O', 'O', 'O', 'O', 'O', 'O', 'O', 'O', 'O', 'O', 'O', 'O', 'O', 'O', 'O', 'O', 'O', 'O', 'O', 'O', 'O', 'B-GENE', 'O', 'O']	Subcutaneous administration of the somatostatin analogue , octreotide , 100 micrograms thrice daily , resulted in a sustained improvement in diarrhoea and disappearance of faecal incontinence without reducing calcitonin levels .
['No', 'other', 'changes', 'in', 'hematopoietic', 'differentiation', 'status', 'were', 'observed', 'in', 'association', 'with', 'Id', '-', 'SCL', 'expression', '.']	['O', 'O', 'O', 'O', 'O', 'O', 'O', 'O', 'O', 'O', 'O', 'O', 'B-GENE', 'I-GENE', 'I-GENE', 'O', 'O']	No other changes in hematopoietic differentiation status were observed in association with Id - SCL expression .
['Purification', 'and', 'cloning', 'of', 'a', 'novel', 'serine', 'protease', ',', 'RNK', '-', 'Met', '-', '1', ',', 'from', 'the', 'granules', 'of', 'a', 'rat', 'natural', 'killer', 'cell', 'leukemia', '.']	['O', 'O', 'O', 'O', 'O', 'O', 'B-GENE', 'I-GENE', 'O', 'B-GENE', 'I-GENE', 'I-GENE', 'I-GENE', 'I-GENE', 'O', 'O', 'O', 'O', 'O', 'O', 'O', 'O', 'O', 'O', 'O', 'O']	Purification and cloning of a novel serine protease , RNK - Met - 1 , from the granules of a rat natural killer cell leukemia .
['We', 'describe', 'here', '17', 'dominant', 'GCN2', 'mutations', 'that', 'lead', 'to', 'derepression', 'of', 'GCN4', 'expression', 'in', 'the', 'absence', 'of', 'amino', 'acid', 'starvation', '.']	['O', 'O', 'O', 'O', 'B-GENE', 'I-GENE', 'I-GENE', 'O', 'O', 'O', 'O', 'O', 'B-GENE', 'O', 'O', 'O', 'O', 'O', 'O', 'O', 'O', 'O']	We describe here 17 dominant GCN2 mutations that lead to derepression of GCN4 expression in the absence of amino acid starvation .
['In', 'addition', ',', 'the', 'utility', 'of', 'beta', '2', 'transferrin', 'assay', 'in', 'the', 'diagnosis', 'of', 'cerebrospinal', 'fluid', 'otorrhea', 'is', 'presented', '.']	['O', 'O', 'O', 'O', 'O', 'O', 'B-GENE', 'I-GENE', 'I-GENE', 'O', 'O', 'O', 'O', 'O', 'O', 'O', 'O', 'O', 'O', 'O']	In addition , the utility of beta 2 transferrin assay in the diagnosis of cerebrospinal fluid otorrhea is presented .
['The', 'structural', 'genes', 'encoding', 'glyceraldehyde', '-', '3', '-', 'phosphate', 'dehydrogenase', '(', 'GAPDH', ')', ',', '3', '-', 'phosphoglycerate', 'kinase', '(', 'PGK', ')', 'and', 'the', 'N', '-', 'terminal', 'part', 'of', 'triosephosphate', 'isomerase', '(', 'TIM', ')', 'from', 'mesophilic', 'Bacillus', 'megaterium', 'DSM319', 'have', 'been', 'cloned', 'as', 'a', 'gene', 'cluster', '(', 'gap', 'operon', ')', 'by', 'complementation', 'of', 'an', 'Escherichia', 'coli', 'gap', 'amber', 'mutant', '.']	['O', 'O', 'O', 'O', 'B-GENE', 'I-GENE', 'I-GENE', 'I-GENE', 'I-GENE', 'I-GENE', 'O', 'B-GENE', 'O', 'O', 'B-GENE', 'I-GENE', 'I-GENE', 'I-GENE', 'O', 'B-GENE', 'O', 'O', 'O', 'O', 'O', 'O', 'O', 'O', 'B-GENE', 'I-GENE', 'O', 'B-GENE', 'O', 'O', 'O', 'O', 'O', 'O', 'O', 'O', 'O', 'O', 'O', 'O', 'O', 'O', 'B-GENE', 'I-GENE', 'O', 'O', 'O', 'O', 'O', 'O', 'O', 'B-GENE', 'I-GENE', 'I-GENE', 'O']	The structural genes encoding glyceraldehyde - 3 - phosphate dehydrogenase ( GAPDH ) , 3 - phosphoglycerate kinase ( PGK ) and the N - terminal part of triosephosphate isomerase ( TIM ) from mesophilic Bacillus megaterium DSM319 have been cloned as a gene cluster ( gap operon ) by complementation of an Escherichia coli gap amber mutant .
['To', 'study', 'the', 'significance', 'of', 'these', 'domains', 'and', 'the', 'overall', 'evolutionary', 'conservation', 'of', 'the', 'gene', ',', 'the', 'homolog', 'from', 'Drosophila', 'melanogaster', 'was', 'isolated', 'by', 'low', 'stringency', 'hybridizations', 'using', 'two', 'flanking', 'probes', 'of', 'the', 'human', 'ERCC3', 'cDNA', '.']	['O', 'O', 'O', 'O', 'O', 'O', 'O', 'O', 'O', 'O', 'O', 'O', 'O', 'O', 'O', 'O', 'O', 'O', 'O', 'O', 'O', 'O', 'O', 'O', 'O', 'O', 'O', 'O', 'O', 'O', 'O', 'O', 'O', 'B-GENE', 'I-GENE', 'I-GENE', 'O']	To study the significance of these domains and the overall evolutionary conservation of the gene , the homolog from Drosophila melanogaster was isolated by low stringency hybridizations using two flanking probes of the human ERCC3 cDNA .
['The', 'tramtrack', '(', 'ttk', ')', 'gene', 'of', 'Drosophila', 'encodes', '69', '-', 'kDa', 'and', '88', '-', 'kDa', 'proteins', 'through', 'alternative', 'splicing', 'of', 'the', 'primary', 'ttk', 'transcript', '.']	['O', 'B-GENE', 'O', 'B-GENE', 'O', 'O', 'O', 'O', 'O', 'O', 'O', 'O', 'O', 'O', 'O', 'O', 'O', 'O', 'O', 'O', 'O', 'O', 'O', 'B-GENE', 'I-GENE', 'O']	The tramtrack ( ttk ) gene of Drosophila encodes 69 - kDa and 88 - kDa proteins through alternative splicing of the primary ttk transcript .
['Removal', 'of', 'beta', '2', '-', 'microglobulin', 'by', 'hemodialysis', 'and', 'hemofiltration', ':', 'a', 'four', 'year', 'follow', 'up', '.']	['O', 'O', 'B-GENE', 'I-GENE', 'I-GENE', 'I-GENE', 'O', 'O', 'O', 'O', 'O', 'O', 'O', 'O', 'O', 'O', 'O']	Removal of beta 2 - microglobulin by hemodialysis and hemofiltration : a four year follow up .
['GAL4', '-', 'VP16', '-', 'mediated', 'antirepression', 'required', 'an', 'auxiliary', 'factor', ',', 'denoted', 'as', 'a', 'co', '-', 'antirepressor', ',', 'which', 'was', 'partially', 'purified', 'from', 'Drosophila', 'embryos', '.']	['B-GENE', 'O', 'B-GENE', 'O', 'O', 'O', 'O', 'O', 'O', 'O', 'O', 'O', 'O', 'O', 'O', 'O', 'O', 'O', 'O', 'O', 'O', 'O', 'O', 'O', 'O', 'O']	GAL4 - VP16 - mediated antirepression required an auxiliary factor , denoted as a co - antirepressor , which was partially purified from Drosophila embryos .
['Therefore', ',', 'ICSBP', 'may', 'be', 'involved', 'in', 'maintaining', 'submaximal', 'transcriptional', 'activity', 'of', 'IFN', '-', 'inducible', 'genes', 'in', 'hematopoietic', 'cells', '.']	['O', 'O', 'B-GENE', 'O', 'O', 'O', 'O', 'O', 'O', 'O', 'O', 'O', 'B-GENE', 'O', 'O', 'O', 'O', 'O', 'O', 'O']	Therefore , ICSBP may be involved in maintaining submaximal transcriptional activity of IFN - inducible genes in hematopoietic cells .
['These', 'results', 'indicate', 'a', 'possible', 'involvement', 'of', 'endogenous', 'opioid', 'peptides', 'in', 'the', 'cardiac', 'effects', 'due', 'to', 'myocardial', 'ischaemia', 'and', 'reperfusion', ',', 'mediated', 'by', 'opiate', 'receptors', 'through', 'opiate', 'antagonism', '.']	['O', 'O', 'O', 'O', 'O', 'O', 'O', 'O', 'O', 'O', 'O', 'O', 'O', 'O', 'O', 'O', 'O', 'O', 'O', 'O', 'O', 'O', 'O', 'B-GENE', 'I-GENE', 'O', 'O', 'O', 'O']	These results indicate a possible involvement of endogenous opioid peptides in the cardiac effects due to myocardial ischaemia and reperfusion , mediated by opiate receptors through opiate antagonism .
['Since', 'CENP', '-', 'B', 'gene', 'is', 'conserved', 'in', 'mammalian', 'species', 'and', 'CENP', '-', 'B', 'boxes', 'are', 'found', 'also', 'in', 'mouse', 'centromere', 'satellite', 'DNA', '(', 'minor', 'satellite', ')', ',', 'this', 'sequence', '-', 'specific', 'DNA', '-', 'protein', 'interaction', 'may', 'be', 'important', 'for', 'some', 'kind', 'of', 'common', 'centromere', 'function', '.']	['O', 'B-GENE', 'I-GENE', 'I-GENE', 'I-GENE', 'O', 'O', 'O', 'O', 'O', 'O', 'B-GENE', 'I-GENE', 'I-GENE', 'I-GENE', 'O', 'O', 'O', 'O', 'O', 'O', 'O', 'O', 'O', 'O', 'O', 'O', 'O', 'O', 'O', 'O', 'O', 'O', 'O', 'O', 'O', 'O', 'O', 'O', 'O', 'O', 'O', 'O', 'O', 'O', 'O', 'O']	Since CENP - B gene is conserved in mammalian species and CENP - B boxes are found also in mouse centromere satellite DNA ( minor satellite ) , this sequence - specific DNA - protein interaction may be important for some kind of common centromere function .
['However', ',', 'in', 'the', 'subgroup', 'with', 'normal', 'Ht', '(', '<', '0', '.', '45', 'l', '/', 'l', ';', 'n', '=', '201', ')', 'there', 'was', 'a', 'significant', 'reduction', '(', 'p', '<', '0', '.', '05', ')', 'of', 'the', 'mortality', 'after', '3', 'months', '(', '27', '%', 'and', '16', '%', ',', 'respectively', ')', 'and', 'an', 'increase', 'of', 'independence', 'at', 'home', '(', '35', '%', 'and', '48', '%', ',', 'respectively', ')', 'due', 'to', 'a', 'reduction', 'of', 'the', 'viscosity', 'by', 'means', 'of', 'haemodilution', 'with', 'albumin', '(', 'a', 'specific', 'viscosity', 'effect', 'in', 'the', 'normovolaemic', 'group', ')', '.']	['O', 'O', 'O', 'O', 'O', 'O', 'O', 'O', 'O', 'O', 'O', 'O', 'O', 'O', 'O', 'O', 'O', 'O', 'O', 'O', 'O', 'O', 'O', 'O', 'O', 'O', 'O', 'O', 'O', 'O', 'O', 'O', 'O', 'O', 'O', 'O', 'O', 'O', 'O', 'O', 'O', 'O', 'O', 'O', 'O', 'O', 'O', 'O', 'O', 'O', 'O', 'O', 'O', 'O', 'O', 'O', 'O', 'O', 'O', 'O', 'O', 'O', 'O', 'O', 'O', 'O', 'O', 'O', 'O', 'O', 'O', 'O', 'O', 'O', 'O', 'O', 'B-GENE', 'O', 'O', 'O', 'O', 'O', 'O', 'O', 'O', 'O', 'O', 'O']	However , in the subgroup with normal Ht ( < 0 . 45 l / l ; n = 201 ) there was a significant reduction ( p < 0 . 05 ) of the mortality after 3 months ( 27 % and 16 % , respectively ) and an increase of independence at home ( 35 % and 48 % , respectively ) due to a reduction of the viscosity by means of haemodilution with albumin ( a specific viscosity effect in the normovolaemic group ) .
['Assay', 'of', 'urea', 'by', 'immobilized', 'urease', 'coupled', 'to', 'a', 'differential', 'pH', '-', 'meter', '.']	['O', 'O', 'O', 'O', 'O', 'B-GENE', 'O', 'O', 'O', 'O', 'O', 'O', 'O', 'O']	Assay of urea by immobilized urease coupled to a differential pH - meter .
['Therefore', ',', 'the', 'molecular', 'mechanisms', 'of', 'the', 'estrogen', 'action', 'that', 'govern', 'the', 'lactoferrin', 'gene', 'expression', 'differ', 'between', 'mouse', 'and', 'human', '.']	['O', 'O', 'O', 'O', 'O', 'O', 'O', 'O', 'O', 'O', 'O', 'O', 'B-GENE', 'I-GENE', 'O', 'O', 'O', 'O', 'O', 'O', 'O']	Therefore , the molecular mechanisms of the estrogen action that govern the lactoferrin gene expression differ between mouse and human .
['Four', 'short', 'nucleotide', 'sequences', '(', 'boxes', 'I', 'to', 'IV', ')', 'contribute', 'to', 'the', 'light', 'responsiveness', 'of', 'the', 'parsley', 'chalcone', 'synthase', 'promoter', '.']	['O', 'O', 'O', 'O', 'O', 'O', 'O', 'O', 'O', 'O', 'O', 'O', 'O', 'O', 'O', 'O', 'O', 'B-GENE', 'I-GENE', 'I-GENE', 'I-GENE', 'O']	Four short nucleotide sequences ( boxes I to IV ) contribute to the light responsiveness of the parsley chalcone synthase promoter .
['Exposure', 'to', 'hepatitis', 'B', 'virus', 'in', 'the', 'general', 'population', 'of', 'Hisayama', ',', 'Japan', ':', 'significance', 'of', 'isolated', 'antibody', 'to', 'hepatitis', 'B', 'surface', 'antigen', 'in', 'general', 'population', '.']	['O', 'O', 'O', 'O', 'O', 'O', 'O', 'O', 'O', 'O', 'O', 'O', 'O', 'O', 'O', 'O', 'O', 'O', 'O', 'B-GENE', 'I-GENE', 'I-GENE', 'I-GENE', 'O', 'O', 'O', 'O']	Exposure to hepatitis B virus in the general population of Hisayama , Japan : significance of isolated antibody to hepatitis B surface antigen in general population .
['On', 'the', 'other', 'hand', ',', 'neither', 'phosphate', 'buffered', 'saline', 'injection', 'into', 'the', 'ES', 'nor', 'primary', 'KLH', 'challenges', 'of', 'the', 'ES', 'were', 'capable', 'of', 'elevating', 'the', 'threshold', 'level', 'and', 'changing', 'the', 'latency', '.']	['O', 'O', 'O', 'O', 'O', 'O', 'O', 'O', 'O', 'O', 'O', 'O', 'O', 'O', 'O', 'B-GENE', 'O', 'O', 'O', 'O', 'O', 'O', 'O', 'O', 'O', 'O', 'O', 'O', 'O', 'O', 'O', 'O']	On the other hand , neither phosphate buffered saline injection into the ES nor primary KLH challenges of the ES were capable of elevating the threshold level and changing the latency .
['Previously', ',', 'we', 'showed', 'that', 'SNF2', ',', 'SNF5', ',', 'and', 'SNF6', 'function', 'interdependently', 'in', 'transcriptional', 'activation', ',', 'possibly', 'forming', 'a', 'heteromeric', 'complex', '.']	['O', 'O', 'O', 'O', 'O', 'B-GENE', 'O', 'B-GENE', 'O', 'O', 'B-GENE', 'O', 'O', 'O', 'O', 'O', 'O', 'O', 'O', 'O', 'O', 'O', 'O']	Previously , we showed that SNF2 , SNF5 , and SNF6 function interdependently in transcriptional activation , possibly forming a heteromeric complex .
['NE', 'and', 'PR3', 'assist', 'in', 'the', 'destruction', 'of', 'phagocytosed', 'microorganisms', ',', 'cleave', 'the', 'important', 'connective', '-', 'tissue', 'protein', 'elastin', ',', 'and', 'generate', 'chemotactic', 'activities', 'by', 'forming', 'alpha', '1', '-', 'proteinase', 'inhibitor', 'complexes', 'and', 'elastin', 'peptides', '.']	['B-GENE', 'O', 'B-GENE', 'O', 'O', 'O', 'O', 'O', 'O', 'O', 'O', 'O', 'O', 'O', 'B-GENE', 'I-GENE', 'I-GENE', 'I-GENE', 'I-GENE', 'O', 'O', 'O', 'O', 'O', 'O', 'O', 'B-GENE', 'I-GENE', 'I-GENE', 'I-GENE', 'I-GENE', 'I-GENE', 'O', 'B-GENE', 'I-GENE', 'O']	NE and PR3 assist in the destruction of phagocytosed microorganisms , cleave the important connective - tissue protein elastin , and generate chemotactic activities by forming alpha 1 - proteinase inhibitor complexes and elastin peptides .
['By', 'contrast', ',', 'd', '(', 'T2AG3T', ')', 'and', 'd', '(', 'T2G4T', ')', 'form', 'only', 'the', 'G', '-', 'quadruplex', 'monomer', 'structures', 'independent', 'of', 'K', 'cation', 'concentration', 'as', 'reported', 'previously', '[', 'Sen', ',', 'D', '.', ',', '&', 'Gilbert', ',', 'W', '.']	['O', 'O', 'O', 'B-GENE', 'I-GENE', 'I-GENE', 'I-GENE', 'O', 'B-GENE', 'I-GENE', 'I-GENE', 'I-GENE', 'O', 'O', 'O', 'O', 'O', 'O', 'O', 'O', 'O', 'O', 'O', 'O', 'O', 'O', 'O', 'O', 'O', 'O', 'O', 'O', 'O', 'O', 'O', 'O', 'O', 'O', 'O']	By contrast , d ( T2AG3T ) and d ( T2G4T ) form only the G - quadruplex monomer structures independent of K cation concentration as reported previously [ Sen , D . , & Gilbert , W .
['Exon', '-', 'intron', 'junctions', 'in', 'the', 'human', 'and', 'rat', 'AdoMet', 'decarboxylase', 'genes', 'were', 'in', 'identical', 'positions', 'except', 'that', 'exons', '6', 'and', '7', 'of', 'the', 'human', 'gene', 'formed', 'a', 'single', 'exon', 'in', 'the', 'rat', 'gene', '.']	['O', 'O', 'O', 'O', 'O', 'O', 'O', 'O', 'B-GENE', 'I-GENE', 'I-GENE', 'I-GENE', 'O', 'O', 'O', 'O', 'O', 'O', 'O', 'O', 'O', 'O', 'O', 'O', 'O', 'O', 'O', 'O', 'O', 'O', 'O', 'O', 'O', 'O', 'O']	Exon - intron junctions in the human and rat AdoMet decarboxylase genes were in identical positions except that exons 6 and 7 of the human gene formed a single exon in the rat gene .
['Among', 'the', 'few', 'proteins', 'of', 'the', 'eukaryotic', 'nucleolus', 'that', 'have', 'been', 'characterized', ',', 'four', 'proteins', ',', 'nucleolin', ',', 'fibrillarin', ',', 'SSB1', 'and', 'NSR1', ',', 'possess', 'a', 'common', 'structural', 'motif', ',', 'the', 'GAR', 'domain', ',', 'which', 'is', 'rich', 'in', 'glycine', 'and', 'arginine', 'residues', '.']	['O', 'O', 'O', 'O', 'O', 'O', 'O', 'O', 'O', 'O', 'O', 'O', 'O', 'O', 'O', 'O', 'B-GENE', 'O', 'B-GENE', 'O', 'B-GENE', 'O', 'B-GENE', 'O', 'O', 'O', 'O', 'O', 'O', 'O', 'O', 'O', 'O', 'O', 'O', 'O', 'O', 'O', 'O', 'O', 'O', 'O', 'O']	Among the few proteins of the eukaryotic nucleolus that have been characterized , four proteins , nucleolin , fibrillarin , SSB1 and NSR1 , possess a common structural motif , the GAR domain , which is rich in glycine and arginine residues .
['Mutations', 'in', 'either', 'gene', 'block', 'some', 'crucial', 'late', 'step', 'in', 'assembly', 'of', 'F1', ',', 'causing', 'the', 'alpha', 'and', 'beta', 'subunits', 'to', 'accumulate', 'in', 'mitochondria', 'as', 'inactive', 'aggregates', '(', 'Ackerman', ',', 'S', '.']	['O', 'O', 'O', 'O', 'O', 'O', 'O', 'O', 'O', 'O', 'O', 'O', 'B-GENE', 'O', 'O', 'O', 'O', 'O', 'O', 'O', 'O', 'O', 'O', 'O', 'O', 'O', 'O', 'O', 'O', 'O', 'O', 'O']	Mutations in either gene block some crucial late step in assembly of F1 , causing the alpha and beta subunits to accumulate in mitochondria as inactive aggregates ( Ackerman , S .
['There', 'was', 'however', ',', 'no', 'significant', 'difference', 'in', 'the', 'prevalence', 'of', 'chronic', 'respiratory', 'symptoms', 'between', 'animal', 'food', 'workers', 'with', 'positive', 'and', 'negative', 'skin', 'tests', 'to', 'house', 'dust', 'or', 'to', 'fish', 'flour', 'or', 'among', 'those', 'with', 'increased', 'or', 'normal', 'IgE', '(', 'except', 'for', 'dyspnea', ')', '.']	['O', 'O', 'O', 'O', 'O', 'O', 'O', 'O', 'O', 'O', 'O', 'O', 'O', 'O', 'O', 'O', 'O', 'O', 'O', 'O', 'O', 'O', 'O', 'O', 'O', 'O', 'O', 'O', 'O', 'O', 'O', 'O', 'O', 'O', 'O', 'O', 'O', 'O', 'B-GENE', 'O', 'O', 'O', 'O', 'O', 'O']	There was however , no significant difference in the prevalence of chronic respiratory symptoms between animal food workers with positive and negative skin tests to house dust or to fish flour or among those with increased or normal IgE ( except for dyspnea ) .
['A', '13', 'base', '-', 'pair', 'oligonucleotide', 'spanning', 'nucleotides', '+', '80', 'to', '+', '92', 'of', 'the', '5', 'S', 'RNA', 'gene', 'retained', 'specific', 'and', 'high', '-', 'affinity', 'binding', ',', 'although', 'the', 'latter', 'was', 'reduced', 'sixfold', 'relative', 'to', 'longer', 'DNA', 'fragments', '.']	['O', 'O', 'O', 'O', 'O', 'O', 'O', 'O', 'O', 'O', 'O', 'O', 'O', 'O', 'O', 'B-GENE', 'I-GENE', 'I-GENE', 'I-GENE', 'O', 'O', 'O', 'O', 'O', 'O', 'O', 'O', 'O', 'O', 'O', 'O', 'O', 'O', 'O', 'O', 'O', 'O', 'O', 'O']	A 13 base - pair oligonucleotide spanning nucleotides + 80 to + 92 of the 5 S RNA gene retained specific and high - affinity binding , although the latter was reduced sixfold relative to longer DNA fragments .
['Moreover', ',', 'the', 'reconstitution', 'of', 'eUSF', 'and', 'TFIID', '-', 'depleted', 'transcription', 'complexes', 'with', 'purified', 'protein', 'fractions', 'demonstrate', 'that', 'not', 'only', 'TFIID', 'but', 'also', 'eUSF', 'essentially', 'participates', 'in', 'complex', 'formation', 'even', 'on', 'H5', 'promoter', 'mutations', 'lacking', 'the', 'TATA', '-', 'box', '.']	['O', 'O', 'O', 'O', 'O', 'B-GENE', 'O', 'B-GENE', 'O', 'O', 'O', 'O', 'O', 'O', 'O', 'O', 'O', 'O', 'O', 'O', 'B-GENE', 'O', 'O', 'B-GENE', 'O', 'O', 'O', 'O', 'O', 'O', 'O', 'B-GENE', 'I-GENE', 'O', 'O', 'O', 'O', 'O', 'O', 'O']	Moreover , the reconstitution of eUSF and TFIID - depleted transcription complexes with purified protein fractions demonstrate that not only TFIID but also eUSF essentially participates in complex formation even on H5 promoter mutations lacking the TATA - box .
['The', 'gene', 'encoding', 'IFN', '-', 'gamma', 'was', 'previously', 'found', 'to', 'contain', 'an', 'intronic', 'enhancer', 'element', 'that', 'was', 'not', 'tissue', '-', 'specific', 'in', 'its', 'activity', ',', 'despite', 'the', 'restricted', 'expression', 'of', 'the', 'intact', 'IFN', '-', 'gamma', '-', 'encoding', 'gene', '.']	['O', 'O', 'O', 'B-GENE', 'I-GENE', 'I-GENE', 'O', 'O', 'O', 'O', 'O', 'O', 'O', 'O', 'O', 'O', 'O', 'O', 'O', 'O', 'O', 'O', 'O', 'O', 'O', 'O', 'O', 'O', 'O', 'O', 'O', 'O', 'B-GENE', 'I-GENE', 'I-GENE', 'I-GENE', 'I-GENE', 'I-GENE', 'O']	The gene encoding IFN - gamma was previously found to contain an intronic enhancer element that was not tissue - specific in its activity , despite the restricted expression of the intact IFN - gamma - encoding gene .
