tokens	ner_tags	text
['These', 'findings', 'may', 'provide', 'additional', 'explanatory', 'data', 'for', 'the', 'high', 'susceptibility', 'of', 'SAR', 'patients', 'to', 'incident', 'asthma', '.']	['O', 'O', 'O', 'O', 'O', 'O', 'O', 'O', 'O', 'O', 'O', 'O', 'B-P', 'I-P', 'O', 'O', 'O', 'O']	These findings may provide additional explanatory data for the high susceptibility of SAR patients to incident asthma .
['Once-daily', 'MMX', '(', '', ')', 'mesalamine', 'for', 'endoscopic', 'maintenance', 'of', 'remission', 'of', 'ulcerative', 'colitis', '.']	['O', 'B-I', 'I-I', 'I-I', 'I-I', 'I-I', 'O', 'O', 'O', 'O', 'O', 'B-P', 'I-P', 'I-P', 'O']	Once-daily MMX (  ) mesalamine for endoscopic maintenance of remission of ulcerative colitis .
['RESULTS', 'Overall', ',', '826', 'patients', 'were', 'randomized', 'and', 'dosed', '.']	['O', 'B-P', 'I-P', 'I-P', 'I-P', 'I-P', 'I-P', 'I-P', 'I-P', 'O']	RESULTS Overall , 826 patients were randomized and dosed .
['At', 'month', '6', ',', '83.7', 'and', '77.8', '%', 'of', 'patients', 'receiving', 'MMX', 'mesalamine', 'in', 'the', 'PP', 'and', 'intent-to-treat', '(', 'ITT', ')', 'populations', ',', 'respectively', ',', 'had', 'maintained', 'endoscopic', 'remission', 'compared', 'with', '81.5', '%', '(', 'PP', ')', 'and', '76.9', '%', '(', 'ITT', ')', 'of', 'patients', 'receiving', 'delayed-release', 'mesalamine', '(', '95', '%', 'confidence', 'interval', 'for', 'difference', ':', '-3.9', '%', ',', '8.1', '%', '(', 'PP', ')', ';', '-5.0', '%', ',', '6.9', '%', '(', 'ITT', ')', ')', '.']	['O', 'O', 'O', 'O', 'O', 'O', 'O', 'O', 'O', 'O', 'O', 'O', 'O', 'O', 'O', 'O', 'O', 'O', 'O', 'O', 'O', 'O', 'O', 'O', 'O', 'O', 'B-O', 'I-O', 'I-O', 'O', 'O', 'O', 'O', 'O', 'O', 'O', 'O', 'O', 'O', 'O', 'O', 'O', 'O', 'O', 'O', 'O', 'O', 'O', 'O', 'O', 'O', 'O', 'O', 'O', 'O', 'O', 'O', 'O', 'O', 'O', 'O', 'O', 'O', 'O', 'O', 'O', 'O', 'O', 'O', 'B-O', 'I-O', 'I-O', 'I-O', 'I-O']	At month 6 , 83.7 and 77.8 % of patients receiving MMX mesalamine in the PP and intent-to-treat ( ITT ) populations , respectively , had maintained endoscopic remission compared with 81.5 % ( PP ) and 76.9 % ( ITT ) of patients receiving delayed-release mesalamine ( 95 % confidence interval for difference : -3.9 % , 8.1 % ( PP ) ; -5.0 % , 6.9 % ( ITT ) ) .
['Comparison', 'of', 'four', 'continuously', 'administered', 'progestogen', 'plus', 'oestradiol', 'combinations', 'for', 'climacteric', 'complaints', '.']	['O', 'O', 'O', 'O', 'O', 'B-I', 'I-I', 'I-I', 'O', 'O', 'B-O', 'I-O', 'I-O']	Comparison of four continuously administered progestogen plus oestradiol combinations for climacteric complaints .
['Sixty', 'women', 'with', 'climacteric', 'complaints', 'who', 'had', 'not', 'menstruated', 'for', 'at', 'least', '1', 'year', 'were', 'randomly', 'allocated', 'to', 'receive', 'one', 'of', 'four', 'hormonal', 'replacement', 'regimens', '.']	['B-P', 'I-P', 'I-P', 'I-P', 'I-P', 'I-P', 'I-P', 'I-P', 'I-P', 'I-P', 'I-P', 'I-P', 'I-P', 'I-P', 'O', 'O', 'O', 'O', 'O', 'O', 'O', 'O', 'O', 'O', 'O', 'O']	Sixty women with climacteric complaints who had not menstruated for at least 1 year were randomly allocated to receive one of four hormonal replacement regimens .
['The', 'clinical', 'efficacy', 'was', 'the', 'same', 'although', 'the', 'alleviation', 'of', 'vasomotor', 'symptoms', 'was', 'somewhat', 'slower', 'in', 'those', 'women', 'receiving', 'preparation', 'A', '.']	['O', 'B-O', 'I-O', 'O', 'O', 'O', 'O', 'O', 'O', 'O', 'B-O', 'I-O', 'O', 'O', 'O', 'O', 'O', 'O', 'O', 'O', 'O', 'O']	The clinical efficacy was the same although the alleviation of vasomotor symptoms was somewhat slower in those women receiving preparation A .
['Irregular', 'uterine', 'bleeding', 'was', 'almost', 'entirely', 'confined', 'to', 'the', 'earlier', 'phase', 'of', 'the', 'study', 'and', 'was', 'substantially', 'less', 'with', 'the', 'formulation', 'containing', '1', 'mg', 'norethisterone', 'acetate', '.']	['B-O', 'I-O', 'I-O', 'O', 'O', 'O', 'O', 'O', 'O', 'O', 'O', 'O', 'O', 'O', 'O', 'O', 'O', 'O', 'O', 'O', 'O', 'O', 'O', 'O', 'B-I', 'I-I', 'I-I']	Irregular uterine bleeding was almost entirely confined to the earlier phase of the study and was substantially less with the formulation containing 1 mg norethisterone acetate .
['It', 'is', 'concluded', 'that', 'a', 'continuous', 'oestradiol-progestogen', 'combination', 'can', 'be', 'used', 'for', 'long-term', 'treatment', 'of', 'climacteric', 'complaints', 'in', 'postmenopausal', 'women', 'and', 'that', 'after', '4', 'months', 'the', 'clinical', 'efficacy', 'is', 'the', 'same', 'irrespective', 'of', 'the', 'type', 'and', 'dose', 'of', 'progestogen', 'administered', '.']	['O', 'O', 'O', 'O', 'O', 'O', 'B-I', 'I-I', 'O', 'O', 'O', 'O', 'O', 'O', 'O', 'B-O', 'I-O', 'I-P', 'I-P', 'I-P', 'O', 'O', 'O', 'O', 'O', 'O', 'B-O', 'I-O', 'O', 'O', 'O', 'O', 'O', 'O', 'O', 'O', 'O', 'O', 'B-I', 'O', 'O']	It is concluded that a continuous oestradiol-progestogen combination can be used for long-term treatment of climacteric complaints in postmenopausal women and that after 4 months the clinical efficacy is the same irrespective of the type and dose of progestogen administered .
['Self-reported', 'smoking', 'and', 'drinking', 'and', 'the', 'number', 'of', 'substance', 'using', 'friends', 'were', 'assessed', '5', 'times', 'over', '3', 'years', '.']	['B-O', 'I-O', 'I-O', 'I-O', 'I-P', 'I-P', 'I-P', 'I-P', 'I-P', 'I-P', 'I-P', 'I-P', 'I-P', 'I-P', 'I-P', 'I-P', 'I-P', 'I-P', 'I-P']	Self-reported smoking and drinking and the number of substance using friends were assessed 5 times over 3 years .
['The', 'relationship', 'between', 'peer', 'and', 'adolescent', 'substance', 'use', 'were', 'assessed', 'in', 'parallel', 'processes', 'as', 'part', 'of', 'an', 'autoregressive', 'latent', 'trajectory', 'model', '.']	['O', 'B-I', 'I-I', 'I-O', 'I-O', 'I-O', 'I-O', 'I-O', 'I-I', 'I-I', 'I-I', 'I-I', 'I-I', 'I-I', 'I-I', 'I-I', 'I-I', 'I-I', 'I-I', 'I-I', 'I-I', 'I-I']	The relationship between peer and adolescent substance use were assessed in parallel processes as part of an autoregressive latent trajectory model .
['Bivariate', ',', 'lagged', 'autoregressive', 'analyses', 'of', 'the', 'successive', 'relationships', 'from', 'one', 'assessment', 'to', 'the', 'next', 'showed', 'consistent', ',', 'significant', 'associations', 'from', 'peer', 'use', 'to', 'adolescent', 'substance', 'use', '.']	['O', 'O', 'O', 'O', 'O', 'O', 'O', 'O', 'O', 'O', 'O', 'O', 'O', 'O', 'O', 'O', 'O', 'O', 'O', 'O', 'O', 'B-O', 'I-O', 'I-O', 'I-O', 'I-O', 'I-O', 'I-O']	Bivariate , lagged autoregressive analyses of the successive relationships from one assessment to the next showed consistent , significant associations from peer use to adolescent substance use .
['The', 'association', 'from', 'adolescent', 'to', 'peer', 'use', 'was', 'significant', 'only', 'from', '7th', 'to', '8th', 'grade', '.']	['O', 'O', 'O', 'B-O', 'I-O', 'I-O', 'I-O', 'O', 'O', 'O', 'O', 'O', 'O', 'O', 'O', 'O']	The association from adolescent to peer use was significant only from 7th to 8th grade .
['Peptide', 'T', ':', 'negative', 'trial', 'result', '.']	['B-O', 'I-O', 'I-O', 'I-O', 'I-O', 'I-O', 'I-O']	Peptide T : negative trial result .
['While', 'there', 'was', 'no', 'statistically', 'significant', 'in', 'the', 'number', 'of', 'lymph', 'node', 'dissection', ',', 'operative', 'time', 'and', 'postoperative', 'chest', 'tube', 'drainage', 'time', '.']	['O', 'O', 'O', 'O', 'O', 'O', 'O', 'O', 'O', 'O', 'B-O', 'I-O', 'I-O', 'I-O', 'I-O', 'I-O', 'I-O', 'I-O', 'I-O', 'I-O', 'I-O', 'I-O', 'I-O']	While there was no statistically significant in the number of lymph node dissection , operative time and postoperative chest tube drainage time .
['The', 'effect', 'of', 'surgical', 'trauma', 'and', 'insulin', 'on', 'whole-body', 'protein', 'turnover', 'in', 'parenterally-fed', 'undernourished', 'patients', '.']	['O', 'O', 'O', 'O', 'O', 'O', 'B-I', 'O', 'B-O', 'I-O', 'I-O', 'O', 'B-P', 'I-P', 'I-P', 'I-P']	The effect of surgical trauma and insulin on whole-body protein turnover in parenterally-fed undernourished patients .
['Pre-operatively', ',', 'and', '2', 'h', 'after', 'commencing', 'their', 'post-operative', 'feeds', ',', 'rates', 'of', 'whole-body', 'protein', 'synthesis', 'and', 'breakdown', 'were', 'measured', 'over', 'a', '9-h', 'period', 'following', 'intravenous', 'injection', 'of', 'a', 'single', 'tracer', 'dose', 'of', '15N-glycine', 'by', 'the', 'ammonia', 'and', 'urea', 'end-product', 'methods', '.']	['O', 'O', 'O', 'O', 'O', 'O', 'O', 'O', 'O', 'O', 'O', 'B-O', 'I-O', 'I-O', 'I-O', 'I-O', 'I-O', 'I-O', 'O', 'O', 'O', 'O', 'O', 'O', 'O', 'O', 'O', 'O', 'O', 'O', 'O', 'O', 'O', 'B-I', 'O', 'O', 'O', 'O', 'O', 'O', 'O', 'O']	Pre-operatively , and 2 h after commencing their post-operative feeds , rates of whole-body protein synthesis and breakdown were measured over a 9-h period following intravenous injection of a single tracer dose of 15N-glycine by the ammonia and urea end-product methods .
['Blood', 'glucose', 'and', 'plasma', 'insulin', 'and', 'glucagon', 'concentrations', 'rose', 'post-operatively', 'whether', 'or', 'not', 'insulin', 'was', 'given', ',', 'but', 'the', 'increment', 'in', 'insulin', 'concentration', 'was', 'significantly', 'greater', 'when', 'insulin', 'was', 'given', '.']	['B-O', 'I-O', 'I-O', 'I-O', 'I-O', 'I-O', 'I-O', 'I-O', 'O', 'O', 'O', 'O', 'O', 'B-I', 'O', 'O', 'O', 'O', 'O', 'O', 'O', 'B-O', 'I-O', 'O', 'O', 'O', 'O', 'B-I', 'O', 'O', 'O']	Blood glucose and plasma insulin and glucagon concentrations rose post-operatively whether or not insulin was given , but the increment in insulin concentration was significantly greater when insulin was given .
['Apparent', 'nitrogen', 'balance', 'was', 'positive', 'pre-operatively', 'and', 'became', 'less', 'so', 'post-operatively', 'whether', 'insulin', 'was', 'given', 'or', 'not', '.']	['B-O', 'I-O', 'I-O', 'O', 'O', 'O', 'O', 'O', 'O', 'O', 'O', 'O', 'B-I', 'O', 'O', 'O', 'O', 'O']	Apparent nitrogen balance was positive pre-operatively and became less so post-operatively whether insulin was given or not .
['Similarly', ',', 'post-operative', 'increments', 'in', 'urinary', 'excretion', 'of', 'ammonia', ',', 'creatinine', 'and', '3-methylhistidine', 'were', 'not', 'altered', 'by', 'addition', 'of', 'insulin', '.']	['O', 'O', 'O', 'O', 'O', 'B-O', 'I-O', 'I-O', 'I-O', 'I-O', 'I-O', 'I-O', 'I-O', 'O', 'O', 'O', 'O', 'O', 'O', 'B-I', 'I-I']	Similarly , post-operative increments in urinary excretion of ammonia , creatinine and 3-methylhistidine were not altered by addition of insulin .
['The', 'urea', 'end-product', 'method', 'suggested', 'that', 'there', 'was', 'no', 'change', 'in', 'whole-body', 'protein', 'turnover', 'after', 'surgery', ',', 'whether', 'or', 'not', 'insulin', 'was', 'given', '.']	['O', 'O', 'O', 'O', 'O', 'O', 'O', 'O', 'O', 'O', 'O', 'B-O', 'I-O', 'I-O', 'O', 'O', 'O', 'O', 'O', 'O', 'B-I', 'O', 'O', 'O']	The urea end-product method suggested that there was no change in whole-body protein turnover after surgery , whether or not insulin was given .
['This', 'study', 'does', 'not', 'support', 'the', 'clinical', 'use', 'of', 'insulin', 'as', 'a', 'means', 'of', 'modifying', 'protein', 'metabolic', 'losses', 'after', 'major', 'surgery', '.']	['O', 'O', 'O', 'O', 'O', 'O', 'O', 'O', 'O', 'B-O', 'O', 'O', 'O', 'O', 'O', 'O', 'O', 'O', 'O', 'B-P', 'I-P', 'I-P']	This study does not support the clinical use of insulin as a means of modifying protein metabolic losses after major surgery .
['Impact', 'of', 'work', 'site', 'health', 'promotion', 'on', 'stages', 'of', 'dietary', 'change', ':', 'the', 'Working', 'Well', 'Trial', '.']	['O', 'O', 'B-I', 'I-I', 'I-I', 'I-I', 'O', 'B-P', 'I-P', 'I-P', 'I-P', 'I-P', 'O', 'O', 'O', 'O', 'O']	Impact of work site health promotion on stages of dietary change : the Working Well Trial .
['This', 'report', 'examines', 'associations', 'of', 'stages', 'of', 'change', 'with', 'diet', 'prospectively', 'and', 'addresses', 'whether', '(', '1', ')', 'baseline', 'stage', 'of', 'change', 'predicts', 'participation', ',', '(', '2', ')', 'forward', 'changes', 'in', 'stage', 'movement', 'were', 'greater', 'in', 'treatment', 'work', 'sites', ',', 'and', '(', '3', ')', 'change', 'in', 'stage', 'was', 'associated', 'with', 'adoption', 'of', 'healthful', 'diets', ',', 'using', 'data', 'from', 'a', 'cohort', 'of', '11,237', 'employees', '.']	['O', 'O', 'O', 'O', 'O', 'O', 'O', 'O', 'O', 'O', 'O', 'O', 'O', 'O', 'O', 'O', 'O', 'O', 'O', 'O', 'O', 'O', 'O', 'O', 'O', 'O', 'O', 'O', 'O', 'O', 'O', 'O', 'O', 'O', 'O', 'O', 'O', 'O', 'O', 'O', 'O', 'O', 'O', 'O', 'O', 'O', 'O', 'O', 'O', 'O', 'O', 'O', 'O', 'O', 'O', 'O', 'O', 'B-P', 'I-P', 'I-P', 'I-P', 'I-P', 'I-P']	This report examines associations of stages of change with diet prospectively and addresses whether ( 1 ) baseline stage of change predicts participation , ( 2 ) forward changes in stage movement were greater in treatment work sites , and ( 3 ) change in stage was associated with adoption of healthful diets , using data from a cohort of 11,237 employees .
['Findings', 'indicate', 'that', 'persons', 'in', 'later', 'stages', 'of', 'change', 'reported', 'higher', 'participation', 'levels', '.']	['O', 'O', 'O', 'B-P', 'I-P', 'I-P', 'I-P', 'I-P', 'I-P', 'O', 'O', 'O', 'O', 'O']	Findings indicate that persons in later stages of change reported higher participation levels .
['Net', 'change', 'in', 'diet', 'due', 'to', 'the', 'intervention', 'was', 'modest', '.']	['B-O', 'I-O', 'O', 'O', 'O', 'O', 'O', 'O', 'O', 'O', 'O']	Net change in diet due to the intervention was modest .
['Drug', 'preference', 'in', 'normal', 'volunteers', ':', 'effects', 'of', 'age', 'and', 'time', 'of', 'day', '.']	['O', 'O', 'O', 'B-P', 'I-P', 'I-P', 'O', 'O', 'O', 'O', 'O', 'O', 'O', 'O']	Drug preference in normal volunteers : effects of age and time of day .
['Three', 'groups', 'of', 'subjects', 'were', 'tested', ':', 'i', ')', 'a', 'group', 'of', '40-55-year-old', 'subjects', '(', 'AGE', 'group', ';', 'N', '=', '11', ')', 'who', 'were', 'tested', 'in', 'the', 'morning', ',', 'ii', ')', 'a', 'group', 'of', '21-35-year-old', 'subjects', '(', 'CTL', 'group', ';', 'N', '=', '12', ')', 'who', 'were', 'also', 'tested', 'in', 'the', 'morning', ',', 'and', 'iii', ')', 'a', 'group', 'of', '21-35-year-olds', 'who', 'were', 'tested', 'in', 'the', 'late', 'afternoon', '(', 'AFT', 'group', ';', 'N', '=', '13', ')', '.']	['B-P', 'I-P', 'I-P', 'I-P', 'I-P', 'I-P', 'I-P', 'I-P', 'I-P', 'I-P', 'I-P', 'I-P', 'I-P', 'I-P', 'I-P', 'I-P', 'I-P', 'I-P', 'I-P', 'I-P', 'I-P', 'I-P', 'I-P', 'I-P', 'I-P', 'I-P', 'I-P', 'I-P', 'I-P', 'I-P', 'I-P', 'I-P', 'I-P', 'I-P', 'I-P', 'I-P', 'I-P', 'I-P', 'I-P', 'I-P', 'I-P', 'I-P', 'I-P', 'I-P', 'I-P', 'I-P', 'I-P', 'I-P', 'I-P', 'I-P', 'I-P', 'I-P', 'I-P', 'I-P', 'I-P', 'I-P', 'I-P', 'I-P', 'I-P', 'I-P', 'I-P', 'I-P', 'I-P', 'I-P', 'I-P', 'I-P', 'I-P', 'I-P', 'I-P', 'I-P', 'I-P', 'I-P', 'I-P', 'I-P', 'I-P']	Three groups of subjects were tested : i ) a group of 40-55-year-old subjects ( AGE group ; N = 11 ) who were tested in the morning , ii ) a group of 21-35-year-old subjects ( CTL group ; N = 12 ) who were also tested in the morning , and iii ) a group of 21-35-year-olds who were tested in the late afternoon ( AFT group ; N = 13 ) .
['Disclosure', 'of', 'HSV-2', 'serological', 'test', 'results', 'in', 'the', 'context', 'of', 'an', 'adolescent', 'HIV', 'prevention', 'trial', 'in', 'Kenya', '.']	['O', 'O', 'O', 'O', 'O', 'O', 'O', 'O', 'O', 'O', 'O', 'B-P', 'I-P', 'I-P', 'I-P', 'I-P', 'I-P', 'I-P']	Disclosure of HSV-2 serological test results in the context of an adolescent HIV prevention trial in Kenya .
['OBJECTIVES', 'Herpes', 'simplex', 'virus', 'type', '2', '(', 'HSV-2', ')', 'biomarkers', 'are', 'often', 'used', 'in', 'adolescent', 'sub-Saharan', 'HIV', 'prevention', 'studies', ',', 'but', 'evaluations', 'of', 'test', 'performance', 'and', 'disclosure', 'outcomes', 'are', 'rare', 'in', 'the', 'published', 'literature', '.']	['O', 'O', 'O', 'O', 'O', 'O', 'O', 'O', 'O', 'O', 'O', 'O', 'O', 'O', 'B-P', 'I-P', 'I-P', 'I-P', 'O', 'O', 'O', 'O', 'O', 'O', 'O', 'O', 'O', 'O', 'O', 'O', 'O', 'O', 'O', 'O', 'O']	OBJECTIVES Herpes simplex virus type 2 ( HSV-2 ) biomarkers are often used in adolescent sub-Saharan HIV prevention studies , but evaluations of test performance and disclosure outcomes are rare in the published literature .
['METHODS', 'In', '2011', ',', '837', 'Kenyan', 'orphan', 'youth', 'in', 'grades', '7', 'and', '8', 'enrolled', 'in', 'an', 'HIV', 'prevention', 'clinical', 'trial', 'with', 'HSV-2', 'biomarker', 'outcomes', '.']	['O', 'O', 'O', 'O', 'B-P', 'I-P', 'I-P', 'I-P', 'I-P', 'I-P', 'I-P', 'I-P', 'I-P', 'I-P', 'I-P', 'I-P', 'I-P', 'I-P', 'I-P', 'I-P', 'I-P', 'I-P', 'I-P', 'I-P', 'I-P']	METHODS In 2011 , 837 Kenyan orphan youth in grades 7 and 8 enrolled in an HIV prevention clinical trial with HSV-2 biomarker outcomes .
['Of', 'these', ',', '22', 'positive', 'and', 'all', 'indeterminates', 'were', 'WB', 'tested', ';', '20', 'and', '5', ',', 'respectively', ',', 'were', 'confirmed', 'positive', '.']	['O', 'O', 'O', 'B-P', 'I-P', 'I-P', 'I-P', 'I-P', 'I-P', 'I-P', 'I-P', 'I-P', 'I-P', 'I-P', 'I-P', 'I-P', 'I-P', 'O', 'O', 'O', 'O', 'O']	Of these , 22 positive and all indeterminates were WB tested ; 20 and 5 , respectively , were confirmed positive .
['Self-reported', 'virginity', 'was', 'highly', 'inconsistent', 'with', 'WB-confirmed', 'positives', '.']	['B-O', 'I-O', 'O', 'O', 'O', 'O', 'B-O', 'I-O', 'I-O']	Self-reported virginity was highly inconsistent with WB-confirmed positives .
['Determinants', 'of', 'total', 'and', 'specific', 'IgE', 'in', 'infants', 'with', 'atopic', 'dermatitis', '.']	['O', 'O', 'O', 'O', 'O', 'O', 'O', 'B-P', 'I-P', 'I-P', 'I-P', 'I-P']	Determinants of total and specific IgE in infants with atopic dermatitis .
['In', 'infancy', ',', 'increased', 'total', 'IgE', 'is', 'more', 'affected', 'by', 'factors', 'increasing', 'risk', 'of', 'intercurrent', 'infection', 'and', 'non-specific', 'airway', 'inflammation', ',', 'such', 'as', 'environmental', 'tobacco', 'smoke', 'exposure', '(', 'p', '<', '0.001', ')', 'and', 'the', 'use', 'of', 'gas', 'cookers', '(', 'p', '=', '0.02', ')', '.']	['O', 'O', 'O', 'O', 'B-O', 'I-O', 'O', 'O', 'O', 'O', 'O', 'O', 'O', 'O', 'O', 'O', 'O', 'O', 'O', 'O', 'O', 'O', 'O', 'O', 'O', 'O', 'O', 'O', 'O', 'O', 'O', 'O', 'O', 'O', 'O', 'O', 'O', 'O', 'O', 'O', 'O', 'O', 'O', 'O']	In infancy , increased total IgE is more affected by factors increasing risk of intercurrent infection and non-specific airway inflammation , such as environmental tobacco smoke exposure ( p < 0.001 ) and the use of gas cookers ( p = 0.02 ) .
['Specific', 'allergen', 'sensitization', 'as', 'represented', 'by', 'detectable', 'IgE', 'antibodies', 'is', 'influenced', 'primarily', 'by', 'allergen', 'exposure', '.']	['O', 'B-O', 'I-O', 'O', 'O', 'O', 'O', 'B-O', 'I-O', 'O', 'O', 'O', 'O', 'O', 'O', 'O']	Specific allergen sensitization as represented by detectable IgE antibodies is influenced primarily by allergen exposure .
['[', 'Median', 'and', 'mediolateral', 'episiotomy', ']', '.']	['B-I', 'I-I', 'I-I', 'I-I', 'I-I', 'I-I', 'I-P']	[ Median and mediolateral episiotomy ] .
['One', 'intervention', 'involved', 'a', 'peer-mediated', 'approach', '(', 'PEER', ')', 'and', 'the', 'other', 'involved', 'a', 'child-assisted', 'approach', '(', 'CHILD', ')', '.']	['O', 'O', 'O', 'O', 'B-I', 'I-I', 'I-I', 'I-I', 'I-I', 'O', 'O', 'O', 'O', 'O', 'B-I', 'I-I', 'I-I', 'I-I', 'I-I', 'I-I']	One intervention involved a peer-mediated approach ( PEER ) and the other involved a child-assisted approach ( CHILD ) .
['Sixty', 'children', 'participated', 'from', '56', 'classrooms', 'in', '30', 'schools', '.']	['B-P', 'I-P', 'I-P', 'I-P', 'I-P', 'I-P', 'I-P', 'I-P', 'I-P', 'O']	Sixty children participated from 56 classrooms in 30 schools .
['CONCLUSIONS', 'These', 'data', 'suggest', 'that', 'significant', 'improvements', 'can', 'be', 'made', 'in', 'peer', 'social', 'connections', 'for', 'children', 'with', 'autism', 'spectrum', 'disorders', 'in', 'general', 'education', 'classrooms', 'with', 'a', 'brief', 'intervention', ',', 'and', 'that', 'these', 'gains', 'persist', 'over', 'time', '.']	['O', 'O', 'O', 'O', 'O', 'O', 'O', 'O', 'O', 'B-O', 'I-O', 'I-O', 'I-O', 'I-O', 'O', 'O', 'B-P', 'I-P', 'I-P', 'I-P', 'O', 'O', 'O', 'O', 'O', 'O', 'O', 'O', 'O', 'O', 'O', 'O', 'O', 'O', 'O', 'O', 'O']	CONCLUSIONS These data suggest that significant improvements can be made in peer social connections for children with autism spectrum disorders in general education classrooms with a brief intervention , and that these gains persist over time .
['Lower', 'relapse', 'rates', 'after', 'neighbourhood', 'injection', 'of', 'Corynebacterium', 'parvum', 'in', 'operable', 'cervix', 'carcinoma', '.']	['O', 'O', 'O', 'O', 'O', 'O', 'O', 'B-I', 'I-I', 'O', 'O', 'O', 'O', 'O']	Lower relapse rates after neighbourhood injection of Corynebacterium parvum in operable cervix carcinoma .
['All', 'patients', 'had', 'carcinoma', 'confined', 'to', 'the', 'cervix', ',', 'the', 'upper', 'part', 'of', 'the', 'vagina', 'or', 'the', 'parametrial', 'region', '.']	['B-P', 'I-P', 'I-P', 'I-P', 'I-P', 'I-P', 'I-P', 'I-P', 'I-P', 'I-P', 'I-P', 'I-P', 'I-P', 'I-P', 'I-P', 'I-P', 'I-P', 'I-P', 'I-P', 'I-P']	All patients had carcinoma confined to the cervix , the upper part of the vagina or the parametrial region .
['Only', 'minor', 'side', 'effects', 'of', 'CP', 'were', 'encountered', '.']	['O', 'O', 'B-O', 'I-O', 'O', 'O', 'O', 'O', 'O']	Only minor side effects of CP were encountered .
['A', 'further', '15', 'patients', 'with', 'more', 'advanced', 'malignancies', 'were', 'added', 'to', 'our', 'studies', '.']	['O', 'O', 'B-P', 'I-P', 'I-P', 'I-P', 'I-P', 'I-P', 'I-P', 'I-P', 'I-P', 'I-P', 'I-P', 'I-P']	A further 15 patients with more advanced malignancies were added to our studies .
['In', 'these', ',', 'CP', 'stimulation', 'had', 'no', 'effect', 'on', 'relapse', 'rates', ',', 'but', 'the', 'relapse-free', 'intervals', 'were', 'longer', 'after', 'immune', 'stimulation', ':', 'control', '3.5', 'months', '(', 'mean', ')', '+/-', '1.5', '(', 's.d', '.']	['O', 'O', 'O', 'B-I', 'I-I', 'O', 'O', 'O', 'O', 'B-O', 'I-O', 'O', 'O', 'O', 'B-O', 'I-O', 'O', 'O', 'O', 'B-I', 'I-I', 'I-I', 'O', 'O', 'O', 'O', 'O', 'O', 'O', 'O', 'O', 'O', 'O']	In these , CP stimulation had no effect on relapse rates , but the relapse-free intervals were longer after immune stimulation : control 3.5 months ( mean ) +/- 1.5 ( s.d .
['The', 'potential', 'interaction', 'between', 'racemic', 'warfarin', 'given', 'as', 'a', '25', 'mg', 'single', 'oral', 'dose', 'and', 'chronically', 'administered', 'ketorolac', 'was', 'studied', 'in', '12', 'young', 'healthy', 'male', 'volunteers', '.']	['O', 'O', 'O', 'O', 'B-I', 'I-I', 'O', 'O', 'O', 'B-I', 'I-I', 'I-I', 'I-I', 'I-I', 'I-I', 'I-I', 'I-I', 'I-I', 'O', 'O', 'O', 'B-P', 'I-P', 'I-P', 'I-P', 'I-P', 'I-P']	The potential interaction between racemic warfarin given as a 25 mg single oral dose and chronically administered ketorolac was studied in 12 young healthy male volunteers .
['Ketorolac', 'produced', 'no', 'major', 'change', 'in', 'the', 'pharmacokinetics', 'of', '(', 'R', ')', '-', 'or', '(', 'S', ')', '-warfarin', '.']	['B-I', 'O', 'B-O', 'I-O', 'I-O', 'I-O', 'I-O', 'I-O', 'I-O', 'I-O', 'I-O', 'I-O', 'I-O', 'I-O', 'I-O', 'I-O', 'I-O', 'I-O', 'I-O']	Ketorolac produced no major change in the pharmacokinetics of ( R ) - or ( S ) -warfarin .
['Ketorolac', 'increased', 'template', 'bleeding', 'time', 'by', 'a', 'factor', 'of', '1.35', 'as', 'compared', 'with', 'placebo', '.']	['B-I', 'I-O', 'I-O', 'I-O', 'I-O', 'O', 'O', 'O', 'O', 'O', 'O', 'O', 'O', 'O', 'O']	Ketorolac increased template bleeding time by a factor of 1.35 as compared with placebo .
['Positive', 'impact', 'of', 'crisis', 'resource', 'management', 'training', 'on', 'no-flow', 'time', 'and', 'team', 'member', 'verbalisations', 'during', 'simulated', 'cardiopulmonary', 'resuscitation', ':', 'a', 'randomised', 'controlled', 'trial', '.']	['O', 'O', 'O', 'B-I', 'I-I', 'I-I', 'I-I', 'O', 'O', 'O', 'O', 'O', 'O', 'O', 'O', 'B-I', 'I-I', 'I-I', 'I-I', 'O', 'O', 'O', 'O', 'O']	Positive impact of crisis resource management training on no-flow time and team member verbalisations during simulated cardiopulmonary resuscitation : a randomised controlled trial .
['RESULTS', 'NFT', 'rates', 'were', 'significantly', 'lower', 'in', 'the', 'CRM-training', 'group', '(', '31.46.1', '%', 'vs.', '36.36.6', '%', ',', 'p=0.014', ')', '.']	['B-O', 'I-O', 'I-O', 'O', 'O', 'O', 'O', 'O', 'O', 'O', 'O', 'O', 'O', 'O', 'O', 'O', 'O', 'O', 'O', 'O']	RESULTS NFT rates were significantly lower in the CRM-training group ( 31.46.1 % vs. 36.36.6 % , p=0.014 ) .
['OBJECTIVE', 'To', 'investigate', 'the', 'effect', 'of', 'exercise', 'training', 'and', 'dietary', 'macronutrient', 'composition', 'on', '24', 'h', 'substrate', 'oxidation', 'in', 'male', ',', 'obese', 'subjects', '.']	['O', 'O', 'O', 'O', 'O', 'O', 'B-I', 'I-I', 'I-I', 'I-I', 'I-I', 'I-I', 'O', 'B-O', 'I-O', 'I-O', 'I-O', 'O', 'B-P', 'I-P', 'I-P', 'I-P', 'I-P']	OBJECTIVE To investigate the effect of exercise training and dietary macronutrient composition on 24 h substrate oxidation in male , obese subjects .
['DESIGN', 'A', '16', 'month', 'exercise', 'intervention', 'study', 'was', 'executed', ',', 'including', 'a', 'weight', 'loss', 'period', 'with', 'a', 'very', 'low', 'energy', 'diet', '(', 'VLED', ')', 'for', '2', 'months', 'at', 'the', 'start', 'of', 'the', 'study', '.']	['O', 'O', 'O', 'O', 'B-I', 'I-I', 'O', 'O', 'O', 'O', 'O', 'O', 'O', 'O', 'O', 'O', 'O', 'B-I', 'I-I', 'I-I', 'I-I', 'I-I', 'I-I', 'I-I', 'O', 'O', 'O', 'O', 'O', 'O', 'O', 'O', 'O', 'O']	DESIGN A 16 month exercise intervention study was executed , including a weight loss period with a very low energy diet ( VLED ) for 2 months at the start of the study .
