tokens	ner_tags	text
['Seven', 'patients', '(', '10', '%', ')', 'had', 'ST', 'elevation', 'myocardial', 'infarction', ',', '23', 'patients', '(', '32', '%', ')', 'had', 'new', 'ST', 'depressions', ',', 'and', '21', 'patients', '(', '30', '%', ')', 'had', 'no', 'new', 'ST', 'segment', 'changes', 'in', 'the', 'serial', 'electrocardiographic', 'recordings', '.']	['O', 'O', 'O', 'O', 'O', 'O', 'O', 'B-O', 'I-O', 'I-O', 'I-O', 'O', 'O', 'O', 'O', 'O', 'O', 'O', 'O', 'B-O', 'I-O', 'I-O', 'O', 'O', 'O', 'O', 'O', 'O', 'O', 'O', 'O', 'O', 'O', 'O', 'O', 'O', 'O', 'O', 'O', 'O', 'O', 'O']	Seven patients ( 10 % ) had ST elevation myocardial infarction , 23 patients ( 32 % ) had new ST depressions , and 21 patients ( 30 % ) had no new ST segment changes in the serial electrocardiographic recordings .
['How', 'to', 'establish', 'equivalence', 'when', 'data', 'are', 'censored', ':', 'a', 'randomized', 'trial', 'of', 'treatments', 'for', 'B', 'non-Hodgkin', 'lymphoma', '.']	['O', 'O', 'O', 'O', 'O', 'O', 'O', 'O', 'O', 'O', 'B-P', 'I-P', 'I-P', 'I-P', 'I-P', 'I-P', 'I-P', 'I-P', 'I-P']	How to establish equivalence when data are censored : a randomized trial of treatments for B non-Hodgkin lymphoma .
['An', 'equivalence', 'trial', 'of', 'maintenance', 'therapy', 'was', 'carried', 'out', 'in', 'children', 'with', 'B', 'non-Hodgkin', 'lymphoma', ',', 'and', 'serves', 'as', 'an', 'illustration', '.']	['O', 'O', 'O', 'O', 'B-I', 'I-I', 'O', 'O', 'O', 'O', 'B-P', 'I-P', 'I-P', 'I-P', 'I-P', 'O', 'O', 'O', 'O', 'O', 'O', 'O']	An equivalence trial of maintenance therapy was carried out in children with B non-Hodgkin lymphoma , and serves as an illustration .
['There', 'were', 'four', 'randomised', 'treatment', 'phases', ',', 'each', 'of', '4', 'weeks', 'duration', '.']	['O', 'O', 'B-I', 'I-I', 'I-I', 'I-I', 'O', 'O', 'O', 'O', 'O', 'O', 'O']	There were four randomised treatment phases , each of 4 weeks duration .
['Ambulatory', 'BP', 'was', 'performed', 'in', 'the', 'final', 'week', 'of', 'each', 'phase', '.']	['B-O', 'I-O', 'O', 'O', 'O', 'O', 'O', 'O', 'O', 'O', 'O', 'O']	Ambulatory BP was performed in the final week of each phase .
['There', 'was', 'a', 'dose-dependent', 'decrease', 'in', 'ambulatory', 'daytime', 'diastolic', 'and', 'mean', 'arterial', 'BP', 'with', 'the', 'progestogen', 'treatments', 'compared', 'with', 'placebo', '(', 'P', '<', '0.05', ')', '.']	['O', 'O', 'O', 'O', 'B-O', 'I-O', 'I-O', 'I-O', 'I-O', 'I-O', 'I-O', 'I-O', 'I-O', 'O', 'O', 'O', 'O', 'O', 'O', 'O', 'O', 'O', 'O', 'O', 'O', 'O']	There was a dose-dependent decrease in ambulatory daytime diastolic and mean arterial BP with the progestogen treatments compared with placebo ( P < 0.05 ) .
['The', 'authors', 'assessed', 'the', 'safety', 'and', 'effectiveness', 'of', 'atomoxetine', 'monotherapy', 'compared', 'with', 'combined', 'atomoxetine/fluoxetine', 'therapy', 'in', 'a', 'population', 'of', 'children', 'and', 'adolescents', 'with', 'ADHD', 'and', 'concurrent', 'symptoms', 'of', 'depression', 'or', 'anxiety', '.']	['O', 'O', 'O', 'O', 'B-O', 'O', 'B-O', 'O', 'B-I', 'O', 'O', 'O', 'O', 'B-I', 'I-I', 'O', 'O', 'B-P', 'I-P', 'I-P', 'I-P', 'I-P', 'I-P', 'I-P', 'I-P', 'I-P', 'I-P', 'I-P', 'I-P', 'I-P', 'I-P', 'I-P']	The authors assessed the safety and effectiveness of atomoxetine monotherapy compared with combined atomoxetine/fluoxetine therapy in a population of children and adolescents with ADHD and concurrent symptoms of depression or anxiety .
['RESULTS', 'At', 'end', 'point', ',', 'reductions', 'in', 'ADHD', ',', 'depressive', ',', 'and', 'anxiety', 'symptoms', 'were', 'marked', 'for', 'both', 'treatment', 'groups', '(', 'p', '<', '.001', 'for', 'the', 'relevant', 'scale', 'in', 'each', 'symptom', 'cluster', ')', '.']	['O', 'O', 'O', 'O', 'O', 'B-O', 'I-O', 'I-O', 'I-O', 'I-O', 'I-O', 'I-O', 'I-O', 'I-O', 'O', 'O', 'O', 'O', 'O', 'O', 'O', 'O', 'O', 'O', 'O', 'O', 'O', 'O', 'O', 'O', 'O', 'O', 'O', 'O']	RESULTS At end point , reductions in ADHD , depressive , and anxiety symptoms were marked for both treatment groups ( p < .001 for the relevant scale in each symptom cluster ) .
['CONCLUSIONS', 'In', 'pediatric', 'patients', 'with', 'ADHD', 'and', 'comorbid', 'symptoms', 'of', 'depression', 'or', 'anxiety', ',', 'atomoxetine', 'monotherapy', 'appears', 'to', 'be', 'effective', 'for', 'treating', 'ADHD', '.']	['O', 'O', 'B-P', 'I-P', 'I-P', 'I-P', 'I-P', 'I-P', 'I-P', 'I-P', 'I-P', 'I-P', 'I-P', 'O', 'B-I', 'I-I', 'O', 'O', 'O', 'O', 'O', 'O', 'O', 'O']	CONCLUSIONS In pediatric patients with ADHD and comorbid symptoms of depression or anxiety , atomoxetine monotherapy appears to be effective for treating ADHD .
['Anxiety', 'and', 'depressive', 'symptoms', 'also', 'improved', ',', 'but', 'the', 'absence', 'of', 'a', 'placebo-only', 'arm', 'does', 'not', 'allow', 'us', 'to', 'conclude', 'that', 'these', 'effects', 'are', 'specifically', 'the', 'result', 'of', 'treatment', 'with', 'atomoxetine', '.']	['B-O', 'I-O', 'I-O', 'I-O', 'O', 'O', 'O', 'O', 'O', 'O', 'O', 'O', 'O', 'O', 'O', 'O', 'O', 'O', 'O', 'O', 'O', 'O', 'O', 'O', 'O', 'O', 'O', 'O', 'O', 'O', 'B-I', 'I-I']	Anxiety and depressive symptoms also improved , but the absence of a placebo-only arm does not allow us to conclude that these effects are specifically the result of treatment with atomoxetine .
['Double-blind', 'comparison', 'of', 'the', 'efficacy', 'and', 'safety', 'of', 'trandolapril', '2', 'mg', 'and', 'hydrochlorothiazide', '25', 'mg', 'in', 'patients', 'with', 'mild-to-moderate', 'essential', 'hypertension', '.']	['O', 'O', 'O', 'O', 'B-O', 'I-O', 'I-O', 'O', 'B-I', 'O', 'O', 'O', 'B-I', 'O', 'O', 'O', 'B-P', 'I-P', 'I-P', 'I-P', 'I-P', 'I-P']	Double-blind comparison of the efficacy and safety of trandolapril 2 mg and hydrochlorothiazide 25 mg in patients with mild-to-moderate essential hypertension .
['This', 'multicenter', 'international', 'trial', 'recruited', '205', 'patients', 'from', '16', 'investigators', '.']	['O', 'O', 'O', 'O', 'O', 'B-P', 'I-P', 'I-P', 'I-P', 'I-P', 'I-P']	This multicenter international trial recruited 205 patients from 16 investigators .
['After', 'a', '4-week', ',', 'single-blind', 'placebo', 'run-in', ',', 'patients', 'were', 'randomized', 'to', 'receive', '16', 'weeks', 'of', 'trandolapril', '2', 'mg/day', '(', '68', 'patients', ')', ',', 'hydrochlorothiazide', '(', 'HCTZ', ')', '25', 'mg/day', '(', '68', 'patients', ')', ',', 'or', 'the', 'combination', '(', '69', 'patients', ')', '.']	['O', 'O', 'O', 'O', 'B-I', 'I-I', 'O', 'O', 'O', 'O', 'O', 'O', 'O', 'O', 'O', 'O', 'B-I', 'O', 'O', 'O', 'O', 'O', 'O', 'O', 'B-I', 'I-I', 'I-I', 'I-I', 'O', 'O', 'O', 'O', 'O', 'O', 'O', 'B-I', 'I-I', 'I-I', 'O', 'O', 'O', 'O', 'O']	After a 4-week , single-blind placebo run-in , patients were randomized to receive 16 weeks of trandolapril 2 mg/day ( 68 patients ) , hydrochlorothiazide ( HCTZ ) 25 mg/day ( 68 patients ) , or the combination ( 69 patients ) .
['Intention-to-treat', 'analysis', 'showed', 'significant', 'decreases', 'in', 'all', 'three', 'groups', 'in', 'mean', '(', '+/-', 'SEM', ')', 'supine', 'DBP', 'throughout', 'the', 'study', ',', 'with', 'no', 'significant', 'differences', 'at', 'week', '16', 'between', 'trandolapril', '(', '-10.6', '+/-', '1.3', 'mm', 'Hg', ')', 'and', 'HCTZ', '(', '-10.9', '+/-', '1.3', 'mm', 'Hg', ')', '.']	['O', 'O', 'O', 'O', 'O', 'O', 'O', 'O', 'O', 'O', 'O', 'O', 'O', 'O', 'O', 'B-O', 'I-O', 'O', 'O', 'O', 'O', 'O', 'O', 'O', 'O', 'O', 'O', 'O', 'O', 'O', 'O', 'O', 'O', 'O', 'O', 'O', 'O', 'O', 'O', 'O', 'O', 'O', 'O', 'O', 'O', 'O', 'O']	Intention-to-treat analysis showed significant decreases in all three groups in mean ( +/- SEM ) supine DBP throughout the study , with no significant differences at week 16 between trandolapril ( -10.6 +/- 1.3 mm Hg ) and HCTZ ( -10.9 +/- 1.3 mm Hg ) .
['Blood', 'pressure', 'was', 'normalized', 'in', 'the', 'combination', 'group', 'in', '67', '%', 'of', 'patients', ',', 'a', 'significantly', 'higher', 'proportion', 'than', 'either', 'trandolapril', '(', '63', '%', ')', 'or', 'HCTZ', '(', '60', '%', ';', 'p', '=', '0.04', ')', '.']	['B-O', 'I-O', 'O', 'O', 'O', 'O', 'O', 'O', 'O', 'O', 'O', 'O', 'O', 'O', 'O', 'O', 'O', 'O', 'O', 'O', 'O', 'O', 'O', 'O', 'O', 'O', 'O', 'O', 'O', 'O', 'O', 'O', 'O', 'O', 'O', 'O']	Blood pressure was normalized in the combination group in 67 % of patients , a significantly higher proportion than either trandolapril ( 63 % ) or HCTZ ( 60 % ; p = 0.04 ) .
['PURPOSE', 'To', 'evaluate', 'the', 'effects', 'of', 'diltiazem', 'and', 'propranolol', 'in', 'patients', 'with', 'unstable', 'angina', '.']	['O', 'O', 'O', 'O', 'O', 'O', 'B-I', 'I-I', 'I-I', 'O', 'B-P', 'I-P', 'I-P', 'I-P', 'I-P']	PURPOSE To evaluate the effects of diltiazem and propranolol in patients with unstable angina .
['A', 'coronary', 'arteriography', 'was', 'done', 'on', 'study', 'entry', '.']	['O', 'B-I', 'I-I', 'O', 'O', 'O', 'O', 'O', 'O']	A coronary arteriography was done on study entry .
['RESULTS', 'A', 'significative', 'reduction', 'of', 'angina', 'crisis', 'number', ',', 'duration', ',', 'intensity', 'and', 'the', 'number', 'of', 'sublingual', 'nitrates', 'doses', 'were', 'observed', 'equally', 'in', 'both', 'groups', '.']	['O', 'O', 'O', 'B-O', 'I-O', 'I-O', 'I-O', 'I-O', 'I-O', 'I-O', 'I-O', 'I-O', 'I-O', 'I-O', 'I-O', 'I-O', 'I-O', 'I-O', 'I-O', 'O', 'O', 'O', 'O', 'O', 'O', 'O']	RESULTS A significative reduction of angina crisis number , duration , intensity and the number of sublingual nitrates doses were observed equally in both groups .
['The', 'SAP', ',', 'DAP', ',', 'HR', 'and', 'RR', 'did', 'not', 'show', 'statistical', 'differences', 'between', 'groups', '.']	['O', 'B-O', 'I-O', 'I-O', 'I-O', 'I-O', 'I-O', 'I-O', 'O', 'O', 'O', 'O', 'O', 'O', 'O', 'O']	The SAP , DAP , HR and RR did not show statistical differences between groups .
['Individual', 'groups', 'analysis', 'showed', 'significative', 'reductions', 'of', 'SAP', ',', 'DAP', 'and', 'HR', 'in', 'propranolol', 'group', '.']	['O', 'O', 'O', 'O', 'O', 'B-O', 'O', 'B-O', 'I-O', 'I-O', 'I-O', 'I-O', 'O', 'B-I', 'O', 'O']	Individual groups analysis showed significative reductions of SAP , DAP and HR in propranolol group .
['The', 'CKMB', 'data', ',', 'ECG', 'alterations', 'and', 'coronary', 'arteriography', 'characteristics', 'were', 'similar', '.']	['O', 'B-O', 'I-O', 'I-O', 'I-O', 'I-O', 'I-O', 'I-O', 'I-O', 'O', 'O', 'O', 'O']	The CKMB data , ECG alterations and coronary arteriography characteristics were similar .
['Moisture-vapour-permeable', 'film', 'as', 'an', 'outpatient', 'burn', 'dressing', '.']	['B-I', 'I-I', 'O', 'O', 'B-P', 'I-P', 'I-P', 'I-P']	Moisture-vapour-permeable film as an outpatient burn dressing .
['The', 'two', 'treatment', 'groups', 'were', 'closely', 'matched', 'in', 'age', ',', 'sex', ',', 'per', 'cent', 'of', 'BSA', 'burned', ',', 'and', 'in', 'burn', 'severity', 'and', 'locations', '.']	['O', 'B-P', 'I-P', 'I-P', 'I-P', 'I-P', 'I-P', 'I-P', 'I-P', 'I-P', 'I-P', 'I-P', 'I-P', 'I-P', 'I-P', 'I-P', 'I-P', 'I-P', 'I-P', 'I-P', 'I-P', 'I-P', 'I-P', 'I-P', 'I-P']	The two treatment groups were closely matched in age , sex , per cent of BSA burned , and in burn severity and locations .
['The', 'clinical', 'infection', 'rate', 'and', 'time', 'to', 'healing', 'were', 'similar', 'in', 'both', 'groups', '.']	['O', 'B-O', 'I-O', 'I-O', 'I-O', 'I-O', 'I-O', 'I-O', 'O', 'O', 'O', 'O', 'O', 'O']	The clinical infection rate and time to healing were similar in both groups .
['Patients', 'completed', 'a', 'questionnaire', 'before', 'and', '1', 'year', 'after', 'surgery', 'to', 'evaluate', 'symptoms', ',', 'function', ',', 'and', 'overall', 'satisfaction', '.']	['O', 'O', 'O', 'B-I', 'O', 'O', 'O', 'O', 'O', 'O', 'O', 'O', 'O', 'O', 'O', 'O', 'O', 'O', 'O', 'O']	Patients completed a questionnaire before and 1 year after surgery to evaluate symptoms , function , and overall satisfaction .
['The', 'patients', 'in', 'the', 'SH', 'group', 'experienced', 'less', 'postoperative', 'pain/discomfort', 'as', 'scored', 'by', 'pain', 'during', 'bowel', 'movement', '(', 'P', '<', '0.001', ')', ',', 'total', 'analgesic', 'requirement', 'over', 'the', 'first', '3', 'days', '(', 'according', 'to', 'the', 'World', 'Health', 'Organization', '[', 'WHO', ']', 'class', 'II', 'analgesics', '[', 'P', '=', '0.002', ']', ';', 'class', 'III', '[', 'P', '=', '0.066', ']', ')', ',', 'and', 'per-patient', 'consumption', 'frequency', 'of', 'class', 'III', 'analgesics', '(', 'P', '=', '0.089', ')', '.']	['O', 'O', 'O', 'O', 'B-I', 'O', 'O', 'O', 'B-O', 'I-O', 'O', 'O', 'O', 'B-O', 'I-O', 'I-O', 'I-O', 'O', 'O', 'O', 'O', 'O', 'O', 'B-O', 'I-O', 'I-O', 'I-O', 'I-O', 'I-O', 'I-O', 'I-O', 'O', 'O', 'O', 'O', 'O', 'O', 'O', 'O', 'O', 'O', 'O', 'O', 'O', 'O', 'O', 'O', 'O', 'O', 'O', 'O', 'O', 'O', 'O', 'O', 'O', 'O', 'O', 'O', 'O', 'O', 'O', 'O', 'O', 'O', 'O', 'O', 'O', 'O', 'O', 'O', 'O', 'O']	The patients in the SH group experienced less postoperative pain/discomfort as scored by pain during bowel movement ( P < 0.001 ) , total analgesic requirement over the first 3 days ( according to the World Health Organization [ WHO ] class II analgesics [ P = 0.002 ] ; class III [ P = 0.066 ] ) , and per-patient consumption frequency of class III analgesics ( P = 0.089 ) .
['A', 'clear', 'difference', 'in', 'morphine', 'requirement', 'became', 'evident', 'after', '24', 'hours', '(', 'P', '=', '0.010', ')', '.']	['O', 'O', 'O', 'O', 'B-O', 'I-O', 'O', 'O', 'O', 'O', 'O', 'O', 'O', 'O', 'O', 'O', 'O']	A clear difference in morphine requirement became evident after 24 hours ( P = 0.010 ) .
['Hospital', 'stay', 'was', 'significantly', 'shorter', 'in', 'the', 'SH', 'group', '(', 'SH', '2.2', '+/-', '1.2', '[', '0', ';', '5.0', ']', 'versus', 'MM', '3.1', '+/-', '1.7', '[', '1', ';', '8.0', ']', 'P', '<', '0.001', ')', '.']	['B-O', 'I-O', 'O', 'O', 'O', 'O', 'O', 'B-I', 'O', 'O', 'O', 'O', 'O', 'O', 'O', 'O', 'O', 'O', 'O', 'O', 'B-I', 'O', 'O', 'O', 'O', 'O', 'O', 'O', 'O', 'O', 'O', 'O', 'O', 'O']	Hospital stay was significantly shorter in the SH group ( SH 2.2 +/- 1.2 [ 0 ; 5.0 ] versus MM 3.1 +/- 1.7 [ 1 ; 8.0 ] P < 0.001 ) .
['CONCLUSION', 'Stapled', 'hemorrhoidopexy', 'causes', 'significantly', 'less', 'postoperative', 'pain', '.']	['O', 'B-I', 'I-I', 'O', 'O', 'O', 'B-O', 'I-O', 'I-O']	CONCLUSION Stapled hemorrhoidopexy causes significantly less postoperative pain .
['The', 'technique', 'is', 'reproducible', 'and', 'can', 'achieve', 'comparable', 'outcomes', 'as', 'those', 'of', 'the', 'MM', 'technique', 'as', 'long', 'as', 'the', 'well-described', 'steps', 'of', 'the', 'technique', 'are', 'followed', '.']	['O', 'O', 'O', 'O', 'O', 'O', 'O', 'O', 'B-O', 'O', 'O', 'O', 'O', 'B-I', 'O', 'O', 'O', 'O', 'O', 'O', 'O', 'O', 'O', 'O', 'O', 'O', 'O']	The technique is reproducible and can achieve comparable outcomes as those of the MM technique as long as the well-described steps of the technique are followed .
['Its', 'effectiveness', 'in', 'relieving', 'symptoms', 'is', 'equivalent', 'to', 'conventional', 'surgery', ',', 'and', 'the', 'number', 'of', 'hemorrhoidal', 'prolapse', 'recurrences', 'at', '2', 'years', 'is', 'not', 'significantly', 'different', '.']	['O', 'B-O', 'O', 'O', 'O', 'O', 'O', 'O', 'O', 'O', 'O', 'O', 'O', 'B-O', 'I-O', 'I-O', 'I-O', 'I-O', 'I-O', 'I-O', 'I-O', 'O', 'O', 'O', 'O', 'O']	Its effectiveness in relieving symptoms is equivalent to conventional surgery , and the number of hemorrhoidal prolapse recurrences at 2 years is not significantly different .
['Hemorroidopexy', 'is', 'applicable', 'for', 'treating', 'reducible', 'hemorrhoidal', 'prolapse', '.']	['B-I', 'O', 'O', 'O', 'O', 'O', 'O', 'O', 'O']	Hemorroidopexy is applicable for treating reducible hemorrhoidal prolapse .
['In', 'this', 'study', 'we', 'examined', 'the', 'social', 'behaviors', 'of', '4-', 'to', '12-year-old', 'children', 'with', 'autism', 'spectrum', 'disorders', '(', 'ASD', ';', 'N', '=', '24', ')', 'during', 'three', 'tradic', 'interactions', 'with', 'an', 'adult', 'confederate', 'and', 'an', 'interaction', 'partner', ',', 'where', 'the', 'interaction', 'partner', 'varied', 'randomly', 'among', '(', '1', ')', 'another', 'adult', 'human', ',', '(', '2', ')', 'a', 'touchscreen', 'computer', 'game', ',', 'and', '(', '3', ')', 'a', 'social', 'dinosaur', 'robot', '.']	['O', 'O', 'O', 'O', 'O', 'O', 'O', 'O', 'O', 'B-P', 'I-P', 'I-P', 'I-P', 'I-P', 'I-P', 'I-P', 'I-P', 'I-P', 'I-P', 'I-P', 'I-P', 'I-P', 'I-P', 'I-P', 'O', 'O', 'O', 'O', 'O', 'B-I', 'I-I', 'I-I', 'I-I', 'I-I', 'I-I', 'I-I', 'O', 'O', 'O', 'O', 'O', 'O', 'O', 'O', 'B-I', 'I-I', 'I-I', 'I-I', 'I-I', 'I-I', 'I-I', 'I-I', 'I-I', 'I-I', 'I-I', 'I-I', 'I-I', 'I-I', 'I-I', 'I-I', 'I-I', 'I-I', 'I-I', 'I-I', 'I-I', 'I-I', 'I-I', 'O']	In this study we examined the social behaviors of 4- to 12-year-old children with autism spectrum disorders ( ASD ; N = 24 ) during three tradic interactions with an adult confederate and an interaction partner , where the interaction partner varied randomly among ( 1 ) another adult human , ( 2 ) a touchscreen computer game , and ( 3 ) a social dinosaur robot .
['The', 'median', 'neutrophil', 'count', 'at', '14', 'days', 'was', 'significantly', 'higher', 'in', 'the', 'GM', 'CSF', 'group', '(', '1.90', 'vs.', '0.46', 'x', '10', '(', '9', ')', '/l', ')', '.']	['O', 'B-O', 'I-O', 'I-O', 'O', 'O', 'O', 'O', 'O', 'O', 'O', 'O', 'B-I', 'I-I', 'O', 'O', 'O', 'O', 'O', 'O', 'O', 'O', 'O', 'O', 'O', 'O', 'O']	The median neutrophil count at 14 days was significantly higher in the GM CSF group ( 1.90 vs. 0.46 x 10 ( 9 ) /l ) .
['Tumor', 'budding', 'is', 'an', 'independent', 'predictor', 'of', 'outcome', 'in', 'AJCC/UICC', 'stage', 'II', 'colorectal', 'cancer', '.']	['B-O', 'I-O', 'O', 'O', 'O', 'O', 'O', 'O', 'O', 'B-P', 'I-P', 'I-P', 'I-P', 'I-P', 'I-P']	Tumor budding is an independent predictor of outcome in AJCC/UICC stage II colorectal cancer .
"['For', 'multivariable', 'analysis', ',', 'Cox', ""'s"", 'proportional', 'hazards', 'regression', 'models', 'were', 'performed', '.']"	['O', 'B-I', 'I-I', 'O', 'O', 'O', 'O', 'O', 'O', 'O', 'O', 'O', 'O']	For multivariable analysis , Cox 's proportional hazards regression models were performed .
"['Cox', ""'s"", 'proportional', 'hazards', 'regression', 'models', 'proved', 'tumor', 'budding', 'to', 'be', 'an', 'independent', 'predictor', 'of', 'disease', 'progression', '(', 'hazard', 'ratio', '3.91', ',', '95', '%', 'confidence', 'interval', '1.3-11.77', ';', 'P', '=', '0.02', ')', 'and', 'cancer-related', 'death', '(', 'hazard', 'ratio', '5.90', ',', '95', '%', 'confidence', 'interval', '1.62-21.51', ';', 'P', '=', '0.007', ')', '.']"	['O', 'O', 'O', 'O', 'O', 'O', 'O', 'B-I', 'I-I', 'O', 'O', 'O', 'O', 'O', 'O', 'B-O', 'I-O', 'O', 'O', 'O', 'O', 'O', 'O', 'O', 'O', 'O', 'O', 'O', 'O', 'O', 'O', 'O', 'B-O', 'I-O', 'I-O', 'O', 'O', 'O', 'O', 'O', 'O', 'O', 'O', 'O', 'O', 'O', 'O', 'O', 'O', 'O', 'O']	Cox 's proportional hazards regression models proved tumor budding to be an independent predictor of disease progression ( hazard ratio 3.91 , 95 % confidence interval 1.3-11.77 ; P = 0.02 ) and cancer-related death ( hazard ratio 5.90 , 95 % confidence interval 1.62-21.51 ; P = 0.007 ) .
['Early', 'versus', 'late', 'hCG', 'administration', 'to', 'trigger', 'ovulation', 'in', 'mild', 'stimulated', 'IUI', 'cycles', ':', 'a', 'randomized', 'clinical', 'trial', '.']	['O', 'O', 'O', 'B-I', 'I-I', 'O', 'O', 'O', 'O', 'O', 'O', 'O', 'O', 'O', 'O', 'O', 'O', 'O', 'O']	Early versus late hCG administration to trigger ovulation in mild stimulated IUI cycles : a randomized clinical trial .
['OBJECTIVES', 'To', 'verify', 'non-inferiority', 'of', 'the', 'clinical', 'pregnancy', 'rate', 'of', 'Early', 'hCG', 'administration', '(', 'leading', 'follicle', 'sizes', 'within', '16.0-16.9', 'mm', 'in', 'diameter', ')', 'compared', 'to', 'Late', 'hCG', 'administration', '(', 'leading', 'follicle', 'sizes', 'within', '18.0-18.9', 'mm', 'in', 'diameter', ')', '.']	['O', 'O', 'O', 'O', 'O', 'O', 'O', 'O', 'O', 'O', 'B-I', 'I-I', 'I-I', 'O', 'O', 'O', 'O', 'O', 'O', 'O', 'O', 'O', 'O', 'O', 'O', 'B-I', 'I-I', 'I-I', 'O', 'O', 'O', 'O', 'O', 'O', 'O', 'O', 'O', 'O', 'O']	OBJECTIVES To verify non-inferiority of the clinical pregnancy rate of Early hCG administration ( leading follicle sizes within 16.0-16.9 mm in diameter ) compared to Late hCG administration ( leading follicle sizes within 18.0-18.9 mm in diameter ) .
['Six', 'hundred', 'and', 'twelve', 'infertile', 'women', 'candidates', 'for', 'intrauterine', 'insemination', '(', 'IUI', ')', 'received', 'HP-hMG', '75', 'IU/day', 'SC', 'from', 'cycle', 'days', '4', 'to', '8', 'and', 'then', 'as', 'per', 'ovarian', 'response', '.']	['B-P', 'I-P', 'I-P', 'I-P', 'I-P', 'I-P', 'I-P', 'I-P', 'I-P', 'I-P', 'I-P', 'I-P', 'I-P', 'O', 'B-I', 'O', 'O', 'O', 'O', 'O', 'O', 'O', 'O', 'O', 'O', 'O', 'O', 'O', 'O', 'O', 'O']	Six hundred and twelve infertile women candidates for intrauterine insemination ( IUI ) received HP-hMG 75 IU/day SC from cycle days 4 to 8 and then as per ovarian response .
['Ovulation', 'was', 'randomly', 'triggered', '(', 'hCG', '5000', 'IU', ',', 'IM', ')', 'when', 'the', 'leading', 'follicle', 'diameter', 'ranged', 'between', 'either', '16.0', 'and', '16.9', 'mm', '(', 'Early', 'hCG', 'group', ',', 'n=227', ')', 'or', '18.0', 'and', '18.9', 'mm', '(', 'Late', 'hCG', 'group', ',', 'n=207', ')', 'and', 'IUI', 'was', 'performed', 'approximately', '36', 'h', 'later', '.']	['O', 'O', 'O', 'O', 'O', 'O', 'O', 'O', 'O', 'O', 'O', 'O', 'O', 'O', 'O', 'O', 'O', 'O', 'O', 'O', 'O', 'O', 'O', 'O', 'O', 'B-I', 'O', 'O', 'O', 'O', 'O', 'O', 'O', 'O', 'O', 'O', 'O', 'O', 'O', 'O', 'O', 'O', 'O', 'O', 'O', 'O', 'O', 'O', 'O', 'O', 'O']	Ovulation was randomly triggered ( hCG 5000 IU , IM ) when the leading follicle diameter ranged between either 16.0 and 16.9 mm ( Early hCG group , n=227 ) or 18.0 and 18.9 mm ( Late hCG group , n=207 ) and IUI was performed approximately 36 h later .
['Clinical', '(', '11.9', '%', 'versus', '12.1', '%', ')', 'and', 'ongoing', '(', '11.0', '%', 'versus', '8.6', '%', ')', 'pregnancy', 'rates', 'per', 'randomized', 'women', 'were', 'similar', 'in', 'the', 'two', 'groups', 'and', 'statistical', 'non-inferiority', 'of', 'clinical', 'and', 'ongoing', 'pregnancy', 'rates', 'was', 'demonstrated', '.']	['O', 'O', 'O', 'O', 'O', 'O', 'O', 'O', 'O', 'O', 'O', 'O', 'O', 'O', 'B-O', 'I-O', 'I-O', 'I-O', 'I-O', 'O', 'B-P', 'I-P', 'O', 'O', 'O', 'O', 'O', 'O', 'O', 'O', 'O', 'B-O', 'I-O', 'I-O', 'I-O', 'I-O', 'O', 'O', 'O', 'O']	Clinical ( 11.9 % versus 12.1 % ) and ongoing ( 11.0 % versus 8.6 % ) pregnancy rates per randomized women were similar in the two groups and statistical non-inferiority of clinical and ongoing pregnancy rates was demonstrated .
['CONCLUSION', 'These', 'results', 'suggest', 'that', 'hCG', 'administered', 'when', 'the', 'largest', 'follicle', 'size', 'reaches', '16.0-16.9', 'mm', 'leads', 'to', 'similar', 'clinical', 'and', 'ongoing', 'pregnancy', 'rates', 'as', 'when', 'it', 'reaches', '18.0-18.9', 'mm', 'in', 'IUI', 'cycles', '.']	['O', 'O', 'O', 'O', 'B-I', 'I-I', 'O', 'O', 'O', 'O', 'O', 'O', 'O', 'O', 'O', 'O', 'O', 'O', 'O', 'O', 'O', 'O', 'O', 'O', 'O', 'O', 'O', 'O', 'O', 'O', 'O', 'O', 'O']	CONCLUSION These results suggest that hCG administered when the largest follicle size reaches 16.0-16.9 mm leads to similar clinical and ongoing pregnancy rates as when it reaches 18.0-18.9 mm in IUI cycles .
['Managing', 'repetitive', 'behaviours', 'in', 'young', 'children', 'with', 'autism', 'spectrum', 'disorder', '(', 'ASD', ')', ':', 'pilot', 'randomised', 'controlled', 'trial', 'of', 'a', 'new', 'parent', 'group', 'intervention', '.']	['O', 'O', 'O', 'O', 'B-P', 'I-P', 'I-P', 'I-P', 'I-P', 'I-P', 'I-P', 'I-P', 'I-P', 'I-P', 'O', 'O', 'O', 'O', 'O', 'O', 'O', 'B-P', 'O', 'O', 'O']	Managing repetitive behaviours in young children with autism spectrum disorder ( ASD ) : pilot randomised controlled trial of a new parent group intervention .
['We', 'report', 'the', 'acceptability', ',', 'feasibility', 'and', 'impact', 'on', 'child', 'functioning', 'of', 'a', 'new', '8', 'weeks', 'parent-group', 'intervention', 'to', 'manage', 'restricted', 'and', 'repetitive', 'behaviours', '(', 'RRB', ')', 'in', 'young', 'children', 'with', 'ASD', 'aged', '3-7', 'years', '.']	['O', 'O', 'O', 'O', 'O', 'O', 'O', 'O', 'O', 'O', 'O', 'O', 'O', 'O', 'B-I', 'I-I', 'I-I', 'I-I', 'I-I', 'I-I', 'I-I', 'I-I', 'I-I', 'I-I', 'I-P', 'I-P', 'I-P', 'I-P', 'I-P', 'I-P', 'I-P', 'I-P', 'I-P', 'I-P', 'I-P', 'I-P']	We report the acceptability , feasibility and impact on child functioning of a new 8 weeks parent-group intervention to manage restricted and repetitive behaviours ( RRB ) in young children with ASD aged 3-7 years .
['Fidelity', 'of', 'delivery', 'was', 'high', ',', 'and', 'attendance', 'was', '90', '%', '.']	['B-O', 'I-O', 'I-O', 'I-O', 'I-O', 'I-O', 'I-O', 'I-O', 'O', 'O', 'O', 'O']	Fidelity of delivery was high , and attendance was 90 % .
['BACKGROUND', 'In', '1998', ',', 'mandatory', 'folic', 'acid', 'fortification', 'of', 'white', 'flour', 'and', 'select', 'cereal', 'grain', 'products', 'was', 'implemented', 'in', 'Canada', 'with', 'the', 'intention', 'to', 'increase', 'dietary', 'folate', 'intakes', 'of', 'reproducing', 'women', '.']	['O', 'O', 'O', 'O', 'O', 'O', 'O', 'O', 'O', 'B-I', 'I-I', 'I-I', 'I-I', 'I-I', 'I-I', 'I-I', 'O', 'O', 'O', 'B-P', 'O', 'O', 'O', 'O', 'O', 'B-I', 'I-I', 'I-I', 'O', 'B-P', 'I-P', 'I-P']	BACKGROUND In 1998 , mandatory folic acid fortification of white flour and select cereal grain products was implemented in Canada with the intention to increase dietary folate intakes of reproducing women .
