tokens	ner_tags	text
['OBJECTIVE', 'To', 'evaluate', 'whether', 'a', 'specific', 'program', 'of', 'moderate-intensity', 'step', 'aerobics', 'training', 'may', 'be', 'sufficient', 'to', 'improve', 'the', 'exercise', 'tolerance', 'of', 'patients', 'with', 'severe', 'chronic', 'heart', 'failure', '.']	['O', 'O', 'O', 'O', 'O', 'O', 'O', 'O', 'B-I', 'I-I', 'I-I', 'I-I', 'O', 'O', 'O', 'O', 'O', 'O', 'O', 'O', 'O', 'B-P', 'I-P', 'I-P', 'I-P', 'I-P', 'I-P', 'I-P']	OBJECTIVE To evaluate whether a specific program of moderate-intensity step aerobics training may be sufficient to improve the exercise tolerance of patients with severe chronic heart failure .
['The', 'control', 'group', 'did', 'not', 'perform', 'a', 'training', 'program', '.']	['O', 'O', 'O', 'O', 'O', 'B-I', 'I-I', 'I-I', 'I-I', 'I-I']	The control group did not perform a training program .
['MAIN', 'OUTCOME', 'MEASURES', 'Peak', 'oxygen', 'uptake', ',', 'peak', 'workload', ',', 'percent', 'of', 'predicted', 'power', 'ability', '.']	['O', 'O', 'O', 'B-O', 'I-O', 'I-O', 'I-O', 'I-O', 'I-O', 'I-O', 'I-O', 'I-O', 'I-O', 'I-O', 'I-O', 'I-O']	MAIN OUTCOME MEASURES Peak oxygen uptake , peak workload , percent of predicted power ability .
['RESULTS', 'Significant', 'increases', 'in', 'peak', 'oxygen', 'uptake', '(', '15', '+/-', '3.4', 'to', '18.5', '+/-', '2.9mL/kg/min', ';', 'p', '=', '.001', ')', ',', 'peak', 'workload', '(', '77', '+/-', '26', 'to', '99', '+/-', '31', 'watts', ';', 'p', '=', '.000', ')', ',', 'and', 'percent', 'of', 'predicted', 'power', 'ability', '(', '43', '%', '+/-', '10', '%', 'to', '56', '%', '+/-', '13', '%', ';', 'p', '=', '.000', ')', 'were', 'observed', 'in', 'the', 'exercise', 'group', '.']	['O', 'O', 'O', 'O', 'B-O', 'I-O', 'I-O', 'O', 'O', 'O', 'O', 'O', 'O', 'O', 'O', 'O', 'O', 'O', 'O', 'O', 'O', 'B-O', 'I-O', 'O', 'O', 'O', 'O', 'O', 'O', 'O', 'O', 'O', 'O', 'O', 'O', 'O', 'O', 'O', 'O', 'B-O', 'I-O', 'I-O', 'I-O', 'I-O', 'O', 'O', 'O', 'O', 'O', 'O', 'O', 'O', 'O', 'O', 'O', 'O', 'O', 'O', 'O', 'O', 'O', 'O', 'O', 'O', 'O', 'O', 'O', 'O']	RESULTS Significant increases in peak oxygen uptake ( 15 +/- 3.4 to 18.5 +/- 2.9mL/kg/min ; p = .001 ) , peak workload ( 77 +/- 26 to 99 +/- 31 watts ; p = .000 ) , and percent of predicted power ability ( 43 % +/- 10 % to 56 % +/- 13 % ; p = .000 ) were observed in the exercise group .
['There', 'were', 'no', 'critical', 'changes', 'in', 'heart', 'rate', 'or', 'blood', 'pressure', 'in', 'either', 'group', '.']	['O', 'O', 'O', 'O', 'O', 'O', 'B-O', 'I-O', 'I-O', 'I-O', 'I-O', 'O', 'O', 'O', 'O']	There were no critical changes in heart rate or blood pressure in either group .
['Following', 'priming', ',', 'an', 'automatic', 'imitation', 'paradigm', 'was', 'used', 'to', 'acquire', 'an', 'index', 'of', 'imitation', '.']	['O', 'O', 'O', 'O', 'O', 'O', 'O', 'O', 'O', 'O', 'O', 'O', 'B-O', 'I-O', 'I-O', 'I-O']	Following priming , an automatic imitation paradigm was used to acquire an index of imitation .
['Whereas', 'imitation', 'levels', 'were', 'higher', 'for', 'pro-socially', 'primed', 'relative', 'to', 'non-socially', 'primed', 'control', 'participants', ',', 'there', 'was', 'no', 'difference', 'between', 'pro-', 'and', 'non-', 'socially', 'primed', 'individuals', 'with', 'ASC', '.']	['O', 'B-O', 'I-O', 'O', 'O', 'O', 'O', 'O', 'O', 'O', 'O', 'O', 'B-P', 'I-P', 'O', 'O', 'O', 'O', 'O', 'O', 'O', 'O', 'O', 'O', 'O', 'B-P', 'I-P', 'I-P', 'I-P']	Whereas imitation levels were higher for pro-socially primed relative to non-socially primed control participants , there was no difference between pro- and non- socially primed individuals with ASC .
['We', 'conclude', 'that', 'high-functioning', 'adults', 'with', 'ASC', 'demonstrate', 'atypical', 'social', 'modulation', 'of', 'imitation', '.']	['O', 'O', 'O', 'B-P', 'I-P', 'I-P', 'I-P', 'O', 'B-O', 'I-O', 'I-O', 'I-O', 'I-O', 'I-O']	We conclude that high-functioning adults with ASC demonstrate atypical social modulation of imitation .
['A', 'limited', 'sampling', 'model', 'has', 'been', 'developed', 'for', 'flunarizine', 'following', 'a', '30', 'mg', 'oral', 'dose', 'in', 'epileptic', 'patients', 'who', 'were', 'receiving', 'phenytoin', 'or', 'carbamazepine', 'or', 'both', ',', 'to', 'estimate', 'the', 'area', 'under', 'the', 'curve', '(', 'AUC', ')', 'and', 'maximum', 'plasma', 'concentration', '(', 'Cmax', ')', '.']	['O', 'O', 'O', 'O', 'O', 'O', 'O', 'O', 'O', 'O', 'O', 'O', 'O', 'O', 'O', 'O', 'B-P', 'I-P', 'I-P', 'I-I', 'I-I', 'I-I', 'I-I', 'I-I', 'I-I', 'I-I', 'I-I', 'I-I', 'I-O', 'I-O', 'I-O', 'I-O', 'I-O', 'I-O', 'I-O', 'I-O', 'I-O', 'I-O', 'I-O', 'I-O', 'I-O', 'I-O', 'I-O', 'I-O', 'I-O']	A limited sampling model has been developed for flunarizine following a 30 mg oral dose in epileptic patients who were receiving phenytoin or carbamazepine or both , to estimate the area under the curve ( AUC ) and maximum plasma concentration ( Cmax ) .
['The', 'model', 'was', 'developed', 'using', 'training', 'data', 'sets', 'from', '30', ',', '20', ',', '15', ',', 'or', '10', 'patients', 'at', 'one', 'or', 'two', 'time', 'points', '.']	['O', 'O', 'O', 'O', 'O', 'O', 'O', 'O', 'O', 'B-P', 'I-P', 'I-P', 'I-P', 'I-P', 'I-P', 'I-P', 'I-P', 'I-P', 'I-P', 'I-P', 'I-P', 'I-P', 'I-P', 'I-P', 'I-P']	The model was developed using training data sets from 30 , 20 , 15 , or 10 patients at one or two time points .
['The', 'model', 'provided', 'reasonably', 'good', 'estimates', 'for', 'both', 'AUC', 'and', 'Cmax', '.']	['O', 'O', 'O', 'O', 'O', 'B-O', 'I-O', 'I-O', 'I-O', 'I-O', 'I-O', 'I-O']	The model provided reasonably good estimates for both AUC and Cmax .
['The', 'bias', 'of', 'the', 'prediction', 'was', '2', '%', 'and', 'precision', 'was', '28', '%', '.']	['O', 'B-O', 'I-O', 'I-O', 'I-O', 'O', 'O', 'O', 'O', 'O', 'O', 'O', 'O', 'O']	The bias of the prediction was 2 % and precision was 28 % .
['The', 'mean', 'predicted', 'Cmax', 'of', 'flunarizine', 'was', '86', '+/-', '32', 'ng', 'mL-1', 'as', 'compared', 'to', 'an', 'observed', 'mean', 'Cmax', 'of', '90', '+/-', '42', 'ng', 'mL-1', '.']	['O', 'O', 'B-O', 'I-O', 'I-O', 'I-O', 'O', 'O', 'O', 'O', 'O', 'O', 'O', 'O', 'O', 'O', 'B-O', 'I-O', 'I-O', 'O', 'O', 'O', 'O', 'O', 'O', 'O']	The mean predicted Cmax of flunarizine was 86 +/- 32 ng mL-1 as compared to an observed mean Cmax of 90 +/- 42 ng mL-1 .
['Naltrexone', 'in', 'young', 'autistic', 'children', ':', 'a', 'double-blind', ',', 'placebo-controlled', 'crossover', 'study', '.']	['B-I', 'O', 'B-P', 'I-P', 'I-P', 'I-P', 'O', 'O', 'O', 'B-I', 'O', 'O', 'O']	Naltrexone in young autistic children : a double-blind , placebo-controlled crossover study .
['OBJECTIVE', 'This', 'study', 'evaluated', 'the', 'efficacy', 'and', 'safety', 'of', 'naltrexone', ',', 'an', 'opiate', 'blocker', ',', 'in', 'the', 'treatment', 'of', 'autism', '.']	['O', 'O', 'O', 'O', 'O', 'B-O', 'I-O', 'I-O', 'O', 'B-I', 'O', 'O', 'O', 'O', 'O', 'O', 'O', 'O', 'O', 'B-P', 'I-P']	OBJECTIVE This study evaluated the efficacy and safety of naltrexone , an opiate blocker , in the treatment of autism .
['Dependent', 'measures', 'included', 'parent', 'and', 'teacher', 'Clinical', 'Global', 'Impressions', '(', 'CGI', ')', ',', 'Conners', 'Rating', 'Scales', ',', 'and', 'Naltrexone', 'Side-Effects', '(', 'SE', ')', 'Rating', 'Scale', ';', 'laboratory', 'CGI', ',', 'movement', 'actometer', 'readings', ',', 'and', 'a', '10-second', 'interval', 'recording', 'system', 'analysis', 'of', 'on-task', ',', 'communication', 'initiations', ',', 'disruptive', 'behavior', ',', 'and', 'self-stimulation', '.']	['B-I', 'I-I', 'I-I', 'I-I', 'I-I', 'I-I', 'I-O', 'I-O', 'I-O', 'I-O', 'I-O', 'I-O', 'I-O', 'I-O', 'I-O', 'I-O', 'I-O', 'I-O', 'I-O', 'I-O', 'I-O', 'I-O', 'I-O', 'I-O', 'I-O', 'I-O', 'I-O', 'I-O', 'I-O', 'I-O', 'I-O', 'I-O', 'I-O', 'I-O', 'I-O', 'I-O', 'I-O', 'I-O', 'I-O', 'I-O', 'I-O', 'I-O', 'I-O', 'I-O', 'I-O', 'I-O', 'I-O', 'I-O', 'I-O', 'I-O', 'I-O', 'I-O']	Dependent measures included parent and teacher Clinical Global Impressions ( CGI ) , Conners Rating Scales , and Naltrexone Side-Effects ( SE ) Rating Scale ; laboratory CGI , movement actometer readings , and a 10-second interval recording system analysis of on-task , communication initiations , disruptive behavior , and self-stimulation .
['Adverse', 'side', 'effects', 'were', 'behavioral', ',', 'mild', ',', 'and', 'transient', '.']	['B-O', 'I-O', 'I-O', 'O', 'O', 'O', 'O', 'O', 'O', 'O', 'O']	Adverse side effects were behavioral , mild , and transient .
['Frequent', 'treatment-emergent', 'grade', '3/4', 'hematologic', 'abnormalities', 'were', 'lymphopenia', '(', '20', '%', 'v', '11', '%', ')', ',', 'anemia', '(', '9', '%', 'v', '8', '%', ')', ',', 'and', 'neutropenia', '(', '6', '%', 'v', '<', '1', '%', ')', '.']	['O', 'O', 'O', 'O', 'B-O', 'I-O', 'O', 'B-O', 'O', 'O', 'O', 'O', 'O', 'O', 'O', 'O', 'B-O', 'O', 'O', 'O', 'O', 'O', 'O', 'O', 'O', 'O', 'B-O', 'O', 'O', 'O', 'O', 'O', 'O', 'O', 'O', 'O']	Frequent treatment-emergent grade 3/4 hematologic abnormalities were lymphopenia ( 20 % v 11 % ) , anemia ( 9 % v 8 % ) , and neutropenia ( 6 % v < 1 % ) .
['RESULTS', 'all-E-Zeaxanthin', 'concentrations', 'increased', 'from', '0.048', '+/-', '0.026', 'micro', 'mol/L', 'at', 'baseline', 'to', '0.20', '+/-', '0.07', 'and', '0.92', '+/-', '0.28', 'micro', 'mol/L', 'with', '1', 'and', '10', 'mg', 'zeaxanthin', ',', 'respectively', '.']	['O', 'B-O', 'I-O', 'O', 'O', 'O', 'O', 'O', 'O', 'O', 'O', 'O', 'O', 'O', 'O', 'O', 'O', 'O', 'O', 'O', 'O', 'O', 'O', 'O', 'O', 'O', 'O', 'B-I', 'O', 'O', 'O']	RESULTS all-E-Zeaxanthin concentrations increased from 0.048 +/- 0.026 micro mol/L at baseline to 0.20 +/- 0.07 and 0.92 +/- 0.28 micro mol/L with 1 and 10 mg zeaxanthin , respectively .
['The', 'dose-normalized', 'bioavailability', 'of', 'all-E-zeaxanthin', 'after', 'the10-mg', 'dose', 'was', '40', '%', 'lower', '(', 'P', '<', '0.001', ')', 'than', 'after', 'the', '1-mg', 'dose', '.']	['O', 'B-O', 'I-O', 'I-O', 'I-O', 'O', 'O', 'O', 'O', 'O', 'O', 'O', 'O', 'O', 'O', 'O', 'O', 'O', 'O', 'O', 'O', 'O', 'O']	The dose-normalized bioavailability of all-E-zeaxanthin after the10-mg dose was 40 % lower ( P < 0.001 ) than after the 1-mg dose .
['Other', 'kinetic', 'parameters', 'did', 'not', 'differ', 'significantly', 'between', 'groups', '.']	['O', 'B-O', 'I-O', 'O', 'O', 'O', 'O', 'O', 'O', 'O']	Other kinetic parameters did not differ significantly between groups .
"['The', 'time', 'course', 'of', 'plasma', ""all-E-3-'dehydro-lutein"", 'concentrations', 'resembled', 'that', 'of', 'all-E-zeaxanthin', '.']"	['O', 'B-O', 'I-O', 'I-O', 'I-O', 'I-O', 'I-O', 'O', 'O', 'O', 'B-I', 'I-I']	The time course of plasma all-E-3-'dehydro-lutein concentrations resembled that of all-E-zeaxanthin .
['Concentrations', 'of', 'other', 'carotenoids', 'were', 'not', 'affected', '.']	['B-O', 'I-O', 'I-O', 'I-O', 'O', 'O', 'O', 'O']	Concentrations of other carotenoids were not affected .
['AIMS', 'We', 'therefore', 'used', 'functional', 'magnetic', 'resonance', 'imaging', '(', 'fMRI', ')', 'to', 'investigate', 'the', 'so', 'far', 'unknown', 'shared', 'and', 'disorder-specific', 'inhibitory', 'brain', 'dysfunctions', 'in', 'these', 'two', 'disorders', ',', 'as', 'well', 'as', 'the', 'effects', 'of', 'a', 'single', 'dose', 'of', 'the', 'selective', 'serotonin', 'reuptake', 'inhibitor', 'fluoxetine', '.']	['O', 'O', 'O', 'O', 'B-I', 'I-I', 'I-I', 'I-I', 'O', 'O', 'O', 'O', 'O', 'O', 'O', 'O', 'O', 'O', 'O', 'O', 'B-O', 'I-O', 'I-O', 'O', 'O', 'O', 'O', 'O', 'O', 'O', 'O', 'O', 'O', 'O', 'O', 'O', 'O', 'O', 'O', 'O', 'O', 'O', 'O', 'O', 'O']	AIMS We therefore used functional magnetic resonance imaging ( fMRI ) to investigate the so far unknown shared and disorder-specific inhibitory brain dysfunctions in these two disorders , as well as the effects of a single dose of the selective serotonin reuptake inhibitor fluoxetine .
['Repeated', 'measures', 'analyses', 'within', 'patients', 'assessed', 'drug', 'effects', '.']	['O', 'O', 'O', 'O', 'O', 'O', 'B-O', 'I-O', 'I-O']	Repeated measures analyses within patients assessed drug effects .
['CONCLUSIONS', 'The', 'findings', 'show', 'that', 'fluoxetine', 'normalises', 'frontal', 'lobe', 'dysfunctions', 'in', 'both', 'disorders', 'via', 'inverse', 'effects', ',', 'downregulating', 'abnormally', 'increased', 'frontal', 'activation', 'in', 'ASD', 'and', 'upregulating', 'abnormally', 'decreased', 'frontal', 'activation', 'in', 'ADHD', ',', 'potentially', 'reflecting', 'inverse', 'baseline', 'serotonin', 'levels', 'in', 'both', 'disorders', '.']	['O', 'O', 'O', 'O', 'O', 'O', 'O', 'B-O', 'I-O', 'I-O', 'O', 'O', 'O', 'O', 'O', 'O', 'O', 'O', 'O', 'O', 'B-O', 'I-O', 'O', 'O', 'O', 'O', 'O', 'O', 'B-O', 'I-O', 'O', 'O', 'O', 'O', 'O', 'O', 'O', 'O', 'O', 'O', 'O', 'O', 'O']	CONCLUSIONS The findings show that fluoxetine normalises frontal lobe dysfunctions in both disorders via inverse effects , downregulating abnormally increased frontal activation in ASD and upregulating abnormally decreased frontal activation in ADHD , potentially reflecting inverse baseline serotonin levels in both disorders .
['A', 'randomized', 'trial', 'of', 'immunotherapy', 'for', 'persistent', 'genital', 'warts', '.']	['O', 'O', 'O', 'O', 'B-I', 'O', 'B-P', 'I-P', 'I-P', 'I-P']	A randomized trial of immunotherapy for persistent genital warts .
['RESULTS', 'Of', '33', 'protocol', 'compliant', 'Brisbane', 'recipients', 'of', 'placebo', 'immunotherapy', ',', '11', 'were', 'disease', 'free', 'at', 'two', 'months', ',', 'and', 'a', 'further', '9', 'demonstrated', 'reduction', 'of', '>', '50', '%', 'in', 'total', 'wart', 'area', '.']	['O', 'B-P', 'I-P', 'I-P', 'I-P', 'I-P', 'I-P', 'I-P', 'I-P', 'I-P', 'O', 'O', 'O', 'O', 'O', 'O', 'O', 'O', 'O', 'O', 'O', 'O', 'O', 'O', 'O', 'O', 'O', 'O', 'O', 'B-O', 'I-O', 'I-O', 'I-O', 'I-O']	RESULTS Of 33 protocol compliant Brisbane recipients of placebo immunotherapy , 11 were disease free at two months , and a further 9 demonstrated reduction of > 50 % in total wart area .
['Wart', 'area', 'reduction', 'following', 'destructive', 'treatment', 'correlated', 'with', 'prior', 'duration', 'of', 'disease', '.']	['B-O', 'I-O', 'I-O', 'O', 'O', 'O', 'O', 'O', 'O', 'O', 'O', 'O', 'O']	Wart area reduction following destructive treatment correlated with prior duration of disease .
['Prior', 'disease', 'duration', 'was', 'much', 'shorter', 'in', 'Wenzhou', 'subject', '(', '8.1', '', '1.1', 'mo', ')', 'than', 'in', 'Brisbane', 'subjects', '(', '53.7', '', '5.5', 'mo', ')', '.']	['B-O', 'I-O', 'O', 'O', 'O', 'O', 'O', 'O', 'O', 'O', 'O', 'O', 'O', 'O', 'O', 'O', 'O', 'O', 'O', 'O', 'O', 'O', 'O', 'O', 'O', 'O']	Prior disease duration was much shorter in Wenzhou subject ( 8.1  1.1 mo ) than in Brisbane subjects ( 53.7  5.5 mo ) .
['No', 'significant', 'reduction', 'in', 'mean', 'wart', 'area', 'was', 'observed', 'for', 'the', '168', 'Wenzhou', 'protocol', 'compliant', 'subjects', 'who', 'also', 'received', 'VLP', 'immunotherapy', '.']	['O', 'O', 'B-O', 'I-O', 'I-O', 'O', 'O', 'O', 'B-P', 'I-P', 'I-P', 'I-P', 'I-P', 'I-P', 'I-P', 'I-P', 'I-P', 'I-P', 'I-P', 'I-P', 'I-P', 'O']	No significant reduction in mean wart area was observed for the 168 Wenzhou protocol compliant subjects who also received VLP immunotherapy .
['CONCLUSIONS', 'This', 'study', 'confirms', 'the', 'findings', 'in', 'a', 'previous', 'open', 'label', 'trial', 'that', 'administration', 'of', 'VLP', 'immunotherapy', 'may', 'assist', 'in', 'clearance', 'of', 'recurrent', 'genital', 'warts', 'in', 'patients', 'for', 'whom', 'destructive', 'therapy', 'is', 'unsuccessful', 'and', 'that', 'unsuccessful', 'destructive', 'therapy', 'is', 'more', 'common', 'with', 'increasing', 'prior', 'disease', 'duration', '.']	['O', 'O', 'O', 'O', 'O', 'O', 'O', 'O', 'O', 'O', 'O', 'O', 'O', 'O', 'O', 'O', 'O', 'O', 'O', 'O', 'O', 'B-O', 'I-O', 'I-O', 'I-P', 'I-P', 'I-P', 'I-P', 'I-P', 'I-P', 'I-P', 'I-P', 'I-P', 'O', 'O', 'O', 'O', 'O', 'O', 'O', 'O', 'O', 'O', 'O', 'O', 'O', 'O']	CONCLUSIONS This study confirms the findings in a previous open label trial that administration of VLP immunotherapy may assist in clearance of recurrent genital warts in patients for whom destructive therapy is unsuccessful and that unsuccessful destructive therapy is more common with increasing prior disease duration .
['The', 'aim', 'of', 'this', 'study', 'was', 'to', 'compare', 'the', 'effect', 'of', 'extracorporeal', 'shock', 'wave', 'therapy', '(', 'ESWT', ')', 'in', 'patients', 'with', 'chronically', 'painful', 'proximal', 'plantar', 'fasciitis', 'with', 'a', 'further', 'conventional', 'conservative', 'treatment', '.']	['O', 'O', 'O', 'O', 'O', 'O', 'O', 'O', 'O', 'O', 'O', 'B-I', 'I-I', 'I-I', 'I-I', 'O', 'O', 'O', 'O', 'O', 'O', 'B-P', 'I-P', 'I-P', 'I-P', 'I-P', 'O', 'O', 'O', 'O', 'O', 'O', 'O']	The aim of this study was to compare the effect of extracorporeal shock wave therapy ( ESWT ) in patients with chronically painful proximal plantar fasciitis with a further conventional conservative treatment .
['Forty-seven', 'patients', '(', '49', 'feet', ')', 'with', 'a', 'previously', 'unsuccessful', 'nonsurgical', 'treatment', 'of', 'at', 'least', '6', 'months', 'were', 'randomized', 'to', 'two', 'groups', '.']	['B-P', 'I-P', 'I-P', 'I-P', 'I-P', 'I-P', 'I-P', 'I-P', 'I-P', 'I-P', 'I-P', 'I-P', 'I-P', 'I-P', 'I-P', 'I-P', 'I-P', 'I-P', 'I-P', 'I-P', 'I-P', 'I-P', 'I-P']	Forty-seven patients ( 49 feet ) with a previously unsuccessful nonsurgical treatment of at least 6 months were randomized to two groups .
['Heel', 'cups', 'had', 'to', 'be', 'worn', 'throughout', 'the', 'study', '.']	['B-I', 'I-I', 'O', 'O', 'O', 'O', 'O', 'O', 'O', 'O']	Heel cups had to be worn throughout the study .
['At', '12', 'weeks', 'after', 'ESWT', ',', 'the', 'pain', 'estimation', 'on', 'the', 'visual', 'analogue', 'scale', '(', 'VAS', ')', 'for', 'activities', 'of', 'daily', 'living', 'diminished', 'significantly', 'by', '62.9', '%', 'in', 'group', '1', 'and', 'by', '63.0', '%', 'in', 'group', '2', '.']	['O', 'O', 'O', 'O', 'O', 'O', 'O', 'B-O', 'I-O', 'I-O', 'I-O', 'I-O', 'I-O', 'I-O', 'I-O', 'I-O', 'I-O', 'I-O', 'I-O', 'I-O', 'I-O', 'I-O', 'O', 'O', 'O', 'O', 'O', 'O', 'O', 'O', 'O', 'O', 'O', 'O', 'O', 'O', 'O', 'O']	At 12 weeks after ESWT , the pain estimation on the visual analogue scale ( VAS ) for activities of daily living diminished significantly by 62.9 % in group 1 and by 63.0 % in group 2 .
['The', 'comfortable', 'walking', 'time', 'had', 'increased', 'significantly', 'in', 'both', 'groups', '.']	['O', 'B-O', 'I-O', 'I-O', 'O', 'O', 'O', 'O', 'O', 'O', 'O']	The comfortable walking time had increased significantly in both groups .
['A', 'pilot', 'study', 'on', 'the', 'efficacy', 'of', 'melodic', 'based', 'communication', 'therapy', 'for', 'eliciting', 'speech', 'in', 'nonverbal', 'children', 'with', 'autism', '.']	['O', 'O', 'O', 'O', 'O', 'O', 'O', 'B-I', 'I-I', 'I-I', 'I-I', 'O', 'B-O', 'I-O', 'O', 'B-P', 'I-P', 'I-P', 'I-P', 'I-P']	A pilot study on the efficacy of melodic based communication therapy for eliciting speech in nonverbal children with autism .
['The', 'purpose', 'of', 'this', 'study', 'was', 'to', 'compare', 'the', 'efficacy', 'of', 'melodic', 'based', 'communication', 'therapy', '(', 'MBCT', ')', 'to', 'traditional', 'speech', 'and', 'language', 'therapy', 'for', 'eliciting', 'speech', 'in', 'nonverbal', 'children', 'with', 'autism', '.']	['O', 'O', 'O', 'O', 'O', 'O', 'O', 'O', 'O', 'O', 'O', 'B-I', 'I-I', 'I-I', 'I-I', 'I-I', 'I-I', 'I-I', 'I-I', 'I-I', 'I-I', 'I-I', 'I-I', 'I-I', 'O', 'B-O', 'I-O', 'O', 'B-P', 'I-P', 'I-P', 'I-P', 'I-P']	The purpose of this study was to compare the efficacy of melodic based communication therapy ( MBCT ) to traditional speech and language therapy for eliciting speech in nonverbal children with autism .
['The', 'MBCT', 'group', 'progressed', 'significantly', 'in', 'number', 'of', 'verbal', 'attempts', 'after', 'weeks', '1', 'through', '4', 'and', 'number', 'of', 'correct', 'words', 'after', 'weeks', '1', 'and', '3', ',', 'while', 'the', 'traditional', 'group', 'progressed', 'significantly', 'after', 'weeks', '4', 'and', '5', '.']	['O', 'O', 'O', 'O', 'O', 'O', 'B-O', 'I-O', 'I-O', 'I-O', 'O', 'O', 'O', 'O', 'O', 'O', 'B-O', 'I-O', 'I-O', 'I-O', 'O', 'O', 'O', 'O', 'O', 'O', 'O', 'O', 'O', 'O', 'O', 'O', 'O', 'O', 'O', 'O', 'O', 'O']	The MBCT group progressed significantly in number of verbal attempts after weeks 1 through 4 and number of correct words after weeks 1 and 3 , while the traditional group progressed significantly after weeks 4 and 5 .
['No', 'significant', 'differences', 'in', 'number', 'of', 'verbal', 'attempts', 'or', 'number', 'of', 'correct', 'words', 'were', 'noted', 'between', 'groups', 'following', 'treatment', '.']	['O', 'O', 'O', 'O', 'B-O', 'I-O', 'I-O', 'I-O', 'I-O', 'I-O', 'I-O', 'I-O', 'I-O', 'O', 'O', 'O', 'O', 'O', 'O', 'O']	No significant differences in number of verbal attempts or number of correct words were noted between groups following treatment .
['The', 'repeat', 'pregnancy', 'rate', 'in', 'the', 'experimental', 'group', 'was', '12', '%', 'after', '18', 'months', ',', 'and', '28', '%', 'in', 'the', 'control', 'group', '.']	['O', 'B-O', 'I-O', 'I-O', 'O', 'O', 'O', 'O', 'O', 'O', 'O', 'O', 'O', 'O', 'O', 'O', 'O', 'O', 'O', 'O', 'O', 'O', 'O']	The repeat pregnancy rate in the experimental group was 12 % after 18 months , and 28 % in the control group .
['After', '12', 'months', ',', 'the', 'infants', 'in', 'the', 'experimental', 'group', 'were', 'more', 'likely', 'to', 'be', 'fully', 'immunized', '(', '33', '%', ')', 'than', 'the', 'infants', 'in', 'the', 'control', 'group', '(', '18', '%', ')', '.']	['O', 'O', 'O', 'O', 'O', 'O', 'O', 'O', 'O', 'O', 'O', 'O', 'O', 'O', 'O', 'B-O', 'I-O', 'O', 'O', 'O', 'O', 'O', 'O', 'O', 'O', 'O', 'O', 'O', 'O', 'O', 'O', 'O', 'O']	After 12 months , the infants in the experimental group were more likely to be fully immunized ( 33 % ) than the infants in the control group ( 18 % ) .
"['Outcome', 'of', 'children', 'with', 'centrally', 'reviewed', 'low-grade', 'gliomas', 'treated', 'with', 'chemotherapy', 'with', 'or', 'without', 'radiotherapy', 'on', 'Children', ""'s"", 'Cancer', 'Group', 'high-grade', 'glioma', 'study', 'CCG-945', '.']"	['B-O', 'O', 'B-P', 'I-P', 'I-P', 'I-P', 'I-P', 'I-P', 'I-P', 'I-P', 'I-I', 'I-I', 'I-I', 'I-I', 'I-I', 'O', 'O', 'O', 'O', 'O', 'O', 'O', 'O', 'O', 'O']	Outcome of children with centrally reviewed low-grade gliomas treated with chemotherapy with or without radiotherapy on Children 's Cancer Group high-grade glioma study CCG-945 .
"['BACKGROUND', 'The', 'objectives', 'of', 'the', 'current', 'study', 'were', 'to', 'determine', 'the', 'outcome', 'of', 'children', 'who', 'were', 'treated', 'with', 'chemotherapy', 'and', 'radiotherapy', 'on', 'the', 'Children', ""'s"", 'Cancer', 'Group', '(', 'CCG', ')', 'high-grade', 'glioma', 'protocol', '(', 'CCG-945', ')', 'who', 'were', 'diagnosed', 'with', 'low-grade', 'gliomas', 'on', 'post', 'hoc', 'central', 'pathologic', 'review', 'and', 'to', 'identify', 'clinical', 'and', 'biologic', 'features', 'associated', 'with', 'prognosis', '.']"	['O', 'O', 'O', 'O', 'O', 'O', 'O', 'O', 'O', 'O', 'O', 'B-O', 'O', 'B-P', 'I-P', 'I-P', 'I-P', 'I-P', 'I-I', 'I-I', 'I-I', 'I-P', 'I-P', 'I-P', 'I-P', 'I-P', 'I-P', 'I-P', 'I-P', 'I-P', 'I-P', 'I-P', 'I-P', 'I-P', 'I-P', 'I-P', 'I-P', 'I-P', 'I-P', 'I-P', 'I-P', 'I-P', 'I-P', 'I-P', 'I-P', 'I-P', 'I-P', 'I-P', 'O', 'O', 'O', 'B-O', 'I-O', 'I-O', 'I-O', 'O', 'O', 'O', 'O']	BACKGROUND The objectives of the current study were to determine the outcome of children who were treated with chemotherapy and radiotherapy on the Children 's Cancer Group ( CCG ) high-grade glioma protocol ( CCG-945 ) who were diagnosed with low-grade gliomas on post hoc central pathologic review and to identify clinical and biologic features associated with prognosis .
['METHODS', 'Between', '1985', 'and', '1991', ',', '250', 'children', 'with', 'institutionally', 'classified', 'high-grade', 'gliomas', 'were', 'enrolled', 'on', 'CCG-945', '.']	['O', 'B-P', 'I-P', 'I-P', 'I-P', 'I-P', 'I-P', 'I-P', 'I-P', 'I-P', 'I-P', 'I-P', 'I-P', 'I-P', 'I-P', 'I-P', 'I-P', 'I-P']	METHODS Between 1985 and 1991 , 250 children with institutionally classified high-grade gliomas were enrolled on CCG-945 .
['Central', 'independent', 'review', 'by', '5', 'neuropathologists', 'led', 'to', 'a', 'reclassification', 'of', 'low-grade', 'glioma', 'in', '70', 'patients', ',', 'who', 'were', 'the', 'focus', 'of', 'the', 'current', 'study', '.']	['O', 'O', 'O', 'O', 'O', 'O', 'O', 'O', 'O', 'O', 'O', 'B-P', 'I-P', 'I-P', 'I-P', 'I-P', 'I-P', 'I-P', 'I-P', 'I-P', 'I-P', 'I-P', 'I-P', 'I-P', 'I-P', 'I-P']	Central independent review by 5 neuropathologists led to a reclassification of low-grade glioma in 70 patients , who were the focus of the current study .
['RESULTS', 'The', 'study', 'involved', '42', 'males', 'and', '28', 'females', '(', 'median', 'age', ',', '7.7', 'years', ')', 'with', 'a', 'median', 'follow-up', 'of', '10.4', 'years', '.']	['O', 'O', 'O', 'O', 'B-P', 'I-P', 'I-P', 'I-P', 'I-P', 'I-P', 'I-P', 'I-P', 'I-P', 'I-P', 'I-P', 'I-P', 'I-P', 'I-P', 'I-P', 'I-P', 'I-P', 'I-P', 'I-P', 'I-P']	RESULTS The study involved 42 males and 28 females ( median age , 7.7 years ) with a median follow-up of 10.4 years .
